Tweet,Date
होलीमा सुनसान उदयपुर https://t.co/sMhm4ZkSd1, Mar 09 2020 
जबर्जस्ती करणी प्रयास : जब जंगलमा अर्धनग्न युवती भेटिइन् https://t.co/JvZ23rGPRG, Mar 09 2020 
तस्बिरमा काठमाडौंको होली https://t.co/BCccrtdPy8, Mar 09 2020 
सकियो मध्यमिथिला परिक्रमा होली पर्सि मनाउने https://t.co/zFr62PjzcW, Mar 09 2020 
कामै नगरी १० लाख भुक्तानी https://t.co/4Eleuey11x, Mar 09 2020 
विकास निर्माणमा महिलाकै भर https://t.co/u1qmbBMEwU, Mar 09 2020 
सडकमा आधा दर्जन घर निजी जग्गामा सडक https://t.co/CsGdvdCVFW, Mar 09 2020 
विश्व अर्थतन्त्रमा ‘धक्का’ https://t.co/dmIpKLpvWB, Mar 09 2020 
कोरोना महामारीको असर : इपिडेमिकबाट प्यानडेमिक https://t.co/CWMd83r5t3, Mar 09 2020 
दक्षिण एसियामा महाशक्तिको चासो https://t.co/WWRy1I8REL, Mar 09 2020 
नेपाली सेनाको व्यापार मोह https://t.co/faaF3tIdtO, Mar 09 2020 
यस्तो गाउँ जहाँ पुरुष जान पाउँदैनन् https://t.co/Z7GDmkYNxM via @Annapurna_Post, Mar 09 2020 
नुवाकोट र रसुवामा सतर्कता https://t.co/zgrHl6kixf, Mar 09 2020 
सिन्धुली अस्पतालमा आइसोलेसन वार्ड https://t.co/MmeoktbnRE, Mar 09 2020 
कतै बलात्कार कतै हत्या प्रयास’ https://t.co/aV2SzCyFzK, Mar 09 2020 
पूर्वका होटल ८० प्रतिशत खाली https://t.co/FG1cQI76Ja, Mar 09 2020 
असुरक्षित अनलाइन बजार https://t.co/c4oiBLajxj, Mar 09 2020 
तीनकुने–एअरपोर्ट–तिलगंगा सडक विस्तार गर्न डीपीआर तयार https://t.co/j6tFDGjSBr, Mar 09 2020 
महिला मन्त्री नहुँदा सत्तापक्षमै असन्तुष्टि https://t.co/cu1lsnZ9L1, Mar 09 2020 
‘इरान एअर’द्वारा यूरोपका लागि उडान रोक्ने निर्णय https://t.co/IaI22Bs5Yw, Mar 09 2020 
कोभिड १९ः इटालीमा एकै दिन १३३ को मृत्यु https://t.co/lM1jW3PaJO via @Annapurna_Post, Mar 09 2020 
यस बैंकका संस्थापक राणा पक्राउ https://t.co/xFO4AOZ9yK, Mar 09 2020 
कोविड १९ : ३ हजार ६ सयको मृत्यु https://t.co/sDY0LLk0Lb, Mar 09 2020 
मनाङ सेमिफाइनलमा https://t.co/Qw1P9P0Y9F, Mar 09 2020 
आजको अन्नपूर्ण पोस्ट ई-पेपर पढ्नुहोस् https://t.co/tfDgUuYUwz https://t.co/BxNJpvY0NI, Mar 09 2020 
प्रहरीमा किन घट्यो शान्ति मिसन आकर्षण ?https://t.co/8BnP9JjjsR, Mar 09 2020 
प्रहरीलाई छल्दै बालविवाह https://t.co/fDm2Niwc9F, Mar 09 2020 
शान्ति मिसनमा नेपाली सेना अब्बल https://t.co/ooXSbYj3no, Mar 09 2020 
इटालीका १ करोड ६० लाखलाई क्वारेन्टाइनमा https://t.co/2HQOqISFFd, Mar 09 2020 
अध्यागमनमा कडाइ : कोरोना छैन ? प्रमाणपत्र ल्याउनुस् https://t.co/JJa9NYkIpm, Mar 09 2020 
रियल मड्रिड पराजित बार्सिलोनालाई ठूलो राहत https://t.co/v3QuxN3DJv, Mar 09 2020 
होली खेले कोरोनाको जोखिम https://t.co/pP8Fhwcpma, Mar 09 2020 
प्रहरीलाई टिपर चालकले पाँच सय घुस दिएपछि.. https://t.co/lwp7C4Rp23 via @Annapurna_Post, Mar 08 2020 
मास्क र स्यानिटाइजरमा भन्सार छुट https://t.co/yP8emcIJqg via @Annapurna_Post, Mar 08 2020 
२५ मेगावाट क्षमताको सोलार प्लान्ट वैशाखभित्र https://t.co/hR9iQv91IT via @Annapurna_Post, Mar 08 2020 
ओमनमा राजदूत ढकालले बुझाइन् ओहोदाको प्रमाणपत्र https://t.co/SnscxHqdxn via @Annapurna_Post, Mar 08 2020 
१२ वर्षपछि यसरी समातिए पत्रकार साहका हत्यारा.. https://t.co/fciksq0E78 via @Annapurna_Post, Mar 08 2020 
संसारका ६ प्रभावशाली महिला : जसलाई सत्ताले घृणा गरे पनि बेवास्ता गर्न सकेन https://t.co/ocAcWC9uUK, Mar 08 2020 
छ महिला जसले ‘होम स्टे’लाई सामुदायिक व्यवसाय बनाए https://t.co/UiLyLAa8sn via @Annapurna_Post, Mar 08 2020 
कोरोना भाइरसबाट जोगिन विश्‍व स्वास्थ्य संगठनका १५ सुझाव https://t.co/eNfGcdV6tG via @Annapurna_Post, Mar 08 2020 
नारी र लगाम https://t.co/kbsZdARrjx, Mar 08 2020 
भारतलाई पराजित गर्दै टी-२० विश्वकप क्रिकेटको उपाधि अष्ट्रेलियालाई https://t.co/B9U1UkWCsI via @Annapurna_Post, Mar 08 2020 
आभारी छु अदिची ! https://t.co/wzM2cBUDWG, Mar 08 2020 
साथी केबल साथी https://t.co/nlyPJTI5rW, Mar 08 2020 
नक्कली नागरिकता बनाएर बेच्ने पूर्वगाविस सचिव पक्राउ https://t.co/n90rwU1i3d via @Annapurna_Post, Mar 08 2020 
महिला रोकिए संसार रोकिन्छ https://t.co/bONfHxnRH0 via @Annapurna_Post, Mar 08 2020 
६ महिनादेखि उडान ठप्प यात्रुलाई सास्ती https://t.co/CaYzyGaz1x via @Annapurna_Post, Mar 08 2020 
प्रधानमन्‍त्रीको मिर्गौला प्रत्यारोपणको पाँचौ दिन : नियमित हिँडडुल सन्तुलित आहार https://t.co/ByxFhhnOGY via @Annapurna_Post, Mar 08 2020 
हतकडीसहित फरार ! https://t.co/wGOR1y0Mia, Mar 08 2020 
घाइतेको हेलिकोप्टरबाट उद्धार https://t.co/EkTrnR8I7a via @Annapurna_Post, Mar 08 2020 
भेडेटार डाँडाबाट जिपलाइनमा सरर...(फोटो फिचर) https://t.co/qfCyMbBGDC via @Annapurna_Post, Mar 08 2020 
मुख्यमन्त्रीलाई शिरै ढाक्ने गुराँसको माला https://t.co/rybU9MglMD via Annapurna Post, Mar 08 2020 
सदरमुकाममा नै कार्यालय राखेर गाउँपालिकाको सेवा https://t.co/SwmEebmvio, Mar 08 2020 
भक्तपुर होलीको भ्रम : 'लिंग भीमसेनको होइन बलात्कारीको हो' https://t.co/fBT7vlwSDm, Mar 08 2020 
बालकथा : पानीबिनाको होली https://t.co/OjqVib3jqt via @Annapurna_Post, Mar 08 2020 
महामारीका कुरा https://t.co/Kd3DIgATxj via @Annapurna_Post, Mar 08 2020 
यसपाली नखेलौं होली https://t.co/AJP8CtVWT7 via @Annapurna_Post, Mar 08 2020 
कोरोना भाइरस : जोखिममा सीमाका कर्मचारी https://t.co/kXjn1rpqdE via @Annapurna_Post, Mar 08 2020 
नेपालबाट अस्ट्रेलिया पुगेका विद्यार्थीमा कोराना संक्रमण https://t.co/s8OS3iYHHY, Mar 08 2020 
ठेकेदारले खाए सवा करोड https://t.co/vHp4NT2HOB via @Annapurna_Post, Mar 08 2020 
७६ सडक अलपत्र https://t.co/c9AlCeP7xJ via @Annapurna_Post, Mar 08 2020 
'अब देउवाबाट कांग्रेस चल्दैन' https://t.co/XNJ4tZ1qy2, Mar 08 2020 
गाउँपालिकाको सेवा लथालिङ https://t.co/kqLtug8hj5 via @Annapurna_Post, Mar 08 2020 
कर्णालीका मन्त्रालय सिंहदरबारकै शैलीमा https://t.co/NGrZFtwpcQ, Mar 08 2020 
सशस्त्र प्रहरी जवानले आफैँलाई हाने गोली https://t.co/mPltxNSS2J via @Annapurna_Post, Mar 08 2020 
अनिमात्र विभेदरहित समाज https://t.co/qP7FF4I97f, Mar 08 2020 
नारी पाइलाका सय वर्ष https://t.co/Jm3r4pveAE, Mar 08 2020 
शिविरकै भरमा आङ खसेका महिला https://t.co/CDScbKo6u6 via @Annapurna_Post, Mar 08 2020 
भान्सामा अल्झेको बौद्धिकता https://t.co/luE3sL2FOJ, Mar 08 2020 
रोकौं धर्मान्धताको विषालु धुवाँ https://t.co/2tcaTMWcMj, Mar 08 2020 
नमुना बस्तीलाई जग्गादान https://t.co/QMGeX0nm45 via @Annapurna_Post, Mar 08 2020 
कृतघ्न कालोबजारी https://t.co/oTDTjqlJeu, Mar 08 2020 
सुरु नै भएन प्रबलीकरण https://t.co/5lzopub5hS via @Annapurna_Post, Mar 08 2020 
गिद्धले कोरल्न सकेनन् बचेरा https://t.co/S70qb4VIpr, Mar 08 2020 
म्यानपावर ठगीमा तीन सयको बकपत्र https://t.co/2bTndVLzGY, Mar 08 2020 
हद बढी जग्गा बेचविखनमा छुट https://t.co/MLDzydWVO4 via @Annapurna_Post, Mar 08 2020 
घरको आसमा झुपडीमै बास https://t.co/6C2UMCIKBe via @Annapurna_Post, Mar 08 2020 
बन्ने भो हजार शैय्याको मेडिकल कलेज https://t.co/TQLz53gAEO via @Annapurna_Post, Mar 08 2020 
इटालीका एक चौथाई जनता क्वारेन्टाइनमा https://t.co/1V3eDcWVoY, Mar 08 2020 
तेल निर्यातमा व्यापारीको तानातान https://t.co/Va2aekAA0H via @Annapurna_Post, Mar 08 2020 
आधारभूत परीक्षालाई ‘हाउगुजी’ बनाइँदै https://t.co/LOuUQthqFE, Mar 08 2020 
वर्षाले आलुखेती प्रभावित https://t.co/BQAnHdxk0C via @Annapurna_Post, Mar 08 2020 
कोरोना संक्रमितको सम्पर्कमा रहेकाहरु बसेको होटल भत्कियो ४ जनाको मत्यु https://t.co/rFkCuFhLja, Mar 08 2020 
कोरोना असर : आधा घटे पर्यटक https://t.co/fbNTPJohHd via @Annapurna_Post, Mar 08 2020 
निरन्तर लागिरहे हत्या अनुसन्धान सफल https://t.co/O1Yiklx5bU, Mar 08 2020 
विद्यालय अनुगमन प्रभावित https://t.co/8lN0I1yTGU, Mar 08 2020 
असुरक्षित धनगढी https://t.co/lBFKaLF5e4 via @Annapurna_Post, Mar 08 2020 
दरबन्दी घटाएर मात्रै बढुवा https://t.co/iiFn0izWOj, Mar 08 2020 
पत्रकार वीरेन्द्र साहको हत्यारा १२ वर्षपछि पक्राउ https://t.co/AZp9Y7FAXY via @Annapurna_Post, Mar 08 2020 
उद्योग बचाउन प्रोत्साहन प्याकेज चाहिन्छ https://t.co/V9iUHmMibQ via @Annapurna_Post, Mar 08 2020 
पूर्वी नवलपरासीमा प्रहरीले गोली चलायो : एक गम्भीर घाइते दुई पक्राउ https://t.co/aM83DjLSN5 via @Annapurna_Post, Mar 08 2020 
राप्रपा एकताको टुंगो समान हैसियतमा तीन अध्यक्ष https://t.co/cBleIvzUWW, Mar 08 2020 
अन्तर्राष्ट्रिय महिला दिवसमा राष्ट्रपतिको शुभकामना https://t.co/wtsytM69jZ via @Annapurna_Post, Mar 08 2020 
युरोपेली मुद्राको अधिमूल्यन उच्च https://t.co/4vnGiSPYoA via @Annapurna_Post, Mar 08 2020 
इदिबमा युद्धविराम सहमति https://t.co/PH9zpXR5Hu via @Annapurna_Post, Mar 08 2020 
स्टिल झिक्नुपर्नेमा हड्डी काटियो https://t.co/g17K5liTLV, Mar 08 2020 
कोविड १९ : १ लाखभन्दा बढी संक्रमित https://t.co/gTo8OaHskp via @Annapurna_Post, Mar 08 2020 
चीनमा दैनिक ११ करोड मास्क उत्पादन https://t.co/Uqcv5WYxpO via @Annapurna_Post, Mar 08 2020 
आजको अन्नपूर्ण पोस्ट ई-पेपर https://t.co/0nCDkTvCU1 https://t.co/JQF8ZaUIJt, Mar 08 2020 
आजको कार्टुन @Annapurna_Post https://t.co/1fkUfupyVw, Mar 08 2020 
जीप दुर्घटना : एकको मृत्यु ६ जना घाइते https://t.co/4U2wZ40Kju via @Annapurna_Post, Mar 08 2020 
जहाँ नारीले चलाउँछन् व्यवहार https://t.co/HqZFlT3ypx, Mar 08 2020 
नारी दिवस विशेष : छोरा नहुँदैमा के भयो र ? https://t.co/ZIrUM5LEGa, Mar 08 2020 
आहा रारा गोल्डकप : पुलिस सेमिफाइनलमा https://t.co/QgNUq3QgJF via @Annapurna_Post, Mar 08 2020 
महिला रोकिए संसार रोकिन्छ https://t.co/bONfHxnRH0 via @Annapurna_Post श्वेता खड्कासँगको कुराकानी, Mar 08 2020 
तर पाइनन् नागरिकता बा रामबहादुर तामाङ २०५९ कात्तिक १० गते र आमा लक्ष्मी २०६६ पुस २० गते संसारबाट बिदा भए। https://t.co/cZk4Ad5AvF, Mar 08 2020 
खोला पूजा गरेर लदी पर्व https://t.co/05NuKErM3L via @Annapurna_Post, Mar 08 2020 
ग्यास गायबमजदुर र विद्यार्थी मर्कामा https://t.co/RRJJYxfA0S, Mar 08 2020 
भैरहवामा नेपाल भारतको बैठक : सीमामा स्वास्थ्य परीक्षण https://t.co/YzVifIYxY4 via @Annapurna_Post, Mar 07 2020 
झापामा कविता तङसिङ-२ https://t.co/y2ppuA0zo0, Mar 07 2020 
कोरोनाबाट जोगिने तीन उपाय (भिडियो) https://t.co/JyXvWv7k9i via @Annapurna_Post, Mar 07 2020 
विश्‍वभर आज : चीनमा क्‍वारेन्टाइन बनाइएको होटल भत्किँदा ७० थुनिए कोरोना संक्रमणबाट इरानी सांसदको मृत्यु https://t.co/AH9Yi3lYl5, Mar 07 2020 
इतिहास लेख्दा मात्र एमाले-माओवादी : नारायणकाजी https://t.co/I4ZvT766Ku via @Annapurna_Post, Mar 07 2020 
चीनमा क्‍वारेन्टाइन बनाइएको होटल भत्किँदा ७० जना थुनिए https://t.co/3elEtYs7BB, Mar 07 2020 
प्रेस सङ्गठनको उपत्यका भेला सम्पन्न : सात बुँदे घोषणापत्र जारी https://t.co/yEdmv2aYeA via @Annapurna_Post, Mar 07 2020 
ब्रिटिश एयरवेजका दुई स्टाफलाई कोरोना संक्रमण https://t.co/A5Opi1aSxG, Mar 07 2020 
कोरोना संक्रमणबाट इरानी सांसदको मृत्यु https://t.co/WcrcwA6qlE, Mar 07 2020 
बिचौलिया बिनै नापीमा काम https://t.co/1JstYWHMAW via @Annapurna_Post, Mar 07 2020 
असमानताको विरोध गर्दै चिलीका स्कुले विद्यार्थीहरु आन्दोलनमा https://t.co/CGe9TSw7q4, Mar 07 2020 
सिमरा गोल्डकप स्थगित https://t.co/8MND4PpZpe via @Annapurna_Post, Mar 07 2020 
फेसबुक र इन्स्टाग्रामले लगायो मेडिकल मास्क बेच्ने विज्ञापनमा प्रतिबन्ध https://t.co/8P6AVzhh7I, Mar 07 2020 
चिनियाँ राष्ट्रपति सीले गरे प्रधानमन्त्रीको स्वास्थ्यलाभ कामना https://t.co/MdTikZUKJq via @Annapurna_Post, Mar 07 2020 
सिमरा विमानस्थलमा ‘हेल्थ डेस्क’ https://t.co/m2bOiseA1q via @Annapurna_Post, Mar 07 2020 
‘नेपाल स्टार’ आजबाट https://t.co/gWQBLG4ICQ, Mar 07 2020 
‘सरकार महँगी बढाउँछ मिटरको भाउ बढाउँदैन’ https://t.co/oByBlAaPft, Mar 07 2020 
प्रधानमन्त्रीलाई नर्मल खाना दिन थालियो https://t.co/FKuT9gbPkv via @Annapurna_Post, Mar 07 2020 
‘देहव्यापारी होइन यौन श्रमिक हौँ’ https://t.co/BaWktS3yVQ, Mar 07 2020 
रहरले को बेचिँदो होला र ? https://t.co/gzVVZ4koX1, Mar 07 2020 
अमेरिकी उपराष्ट्रपति र विदेशमन्त्री सहभागी सभामा दुई कोरोना संक्रमित ! https://t.co/NjfG3nBhap, Mar 07 2020 
जनकपुरमा महामुर्ख खोजिँदै https://t.co/3o1V4GsKjd, Mar 07 2020 
'सरकार लोकतान्त्रिक मूल्य मान्यतामाथि प्रहार गर्न खोज्दैछ' https://t.co/2nVvjF8nsO, Mar 07 2020 
गण्डकी सरकारले गर्‍यो ३ नियुक्ति https://t.co/yPl85LIlpq, Mar 07 2020 
महोत्सव रोक्ने निर्णयपछि मुख्यमन्त्री नै महोत्सव उद्घाटनमा https://t.co/XRBwnM5nJ7, Mar 07 2020 
कोभिड १९ः इटलीमा एकै दिन ४९ को मृत्यु https://t.co/vKq8feEIoB via @Annapurna_Post, Mar 07 2020 
महँगोमा मास्क बेच्‍नेलाई ५० हजार धरौटी https://t.co/M9RTLhPVpR, Mar 07 2020 
उच्च लेकाली क्षेत्रमा हिमपात https://t.co/Qfj7u1Cfg3, Mar 07 2020 
गोरखामा आइसोलेसन वार्ड https://t.co/ZL9wH5mPyZ, Mar 07 2020 
युवतीलाई कुवेत पुर्‍याउन खोज्दा... https://t.co/vhR5Xr22Ry, Mar 07 2020 
मार्च ८ का कार्यक्रम स्थगित https://t.co/7i5fyqozdA, Mar 07 2020 
कोरोना भाइरस : सीमामा लापरबाही https://t.co/CdncOZIRNC, Mar 07 2020 
कोरोना भाइरस : अमेरिकामा १७ को मृत्यु तीन हजार प्रहरी आइसोलेसनमा https://t.co/r0Qz8L1oPy via @Annapurna_Post, Mar 07 2020 
मन्त्रालयको निर्देशन अवज्ञा गर्दै विद्यालय https://t.co/9igeynctCE, Mar 07 2020 
‘अब सकभर प्रधानमन्त्री ओलीको मिर्गौलाले दुःख दिँदैन’ https://t.co/nFYoabWCEB, Mar 07 2020 
महिला निर्देशक भनेको मन पर्दैनथ्यो https://t.co/1CC4Zxm0Xz via @Annapurna_Post, Mar 07 2020 
यसकारण स्वदेशमै प्रधानमन्त्री ओलीको मिर्गौला प्रत्यारोपण https://t.co/XKD5yoH7TL, Mar 07 2020 
निपुतरियाही ! https://t.co/Og9ItRYp72 via @Annapurna_Post मधेशकी आमा, Mar 07 2020 
कोरोना भाइरस : त्रास नफलाऔं सावधानी अपनाऔं https://t.co/JJ1xUzllCO, Mar 07 2020 
मलाई मेरो गर्भमा गर्व छ https://t.co/DQSSnFg14k via @Annapurna_Post फुर्सदमा प्रकाशित लीला लुइटेलको लेख, Mar 07 2020 
विदेशीलाई विभूषण दिन नयाँ व्यवस्था https://t.co/xqkLqEIfdF, Mar 07 2020 
‘खण्डित स्वप्न’को सकस https://t.co/tqoagtEoHW via @Annapurna_Post अर्चना थापाको फुर्सदमा प्रकाशित बहस, Mar 07 2020 
उत्साहजनक उपस्थिति https://t.co/E8cgBsqS7J via @Annapurna_Post फुर्सदमा प्रकाशित सविता आचार्यको पुस्तक बहस, Mar 07 2020 
सामाजिक सञ्जाल कि असामाजिक जञ्जाल ? https://t.co/1yvVK8W1nl via @Annapurna_Post फुर्सदमा प्रकाशित सम्झना वाग्ले भट्टराईको लेख - नयाँ जमाना, Mar 07 2020 
मेरो जन्मथलो मकालुको काखमा... https://t.co/aHVblokNxU, Mar 07 2020 
सुस्त मनस्थितिकी महिला बलात्कार प्रकरण : भारत भागेका गुरुङ फर्किएर जग्गा दलालीमा https://t.co/YWOZ032Hmf, Mar 07 2020 
न्यायमा थिति बसाउन चुनौती https://t.co/qoSWJXQpRv, Mar 07 2020 
पुष्पराज आचार्य लेख्छन् : नेपाल हल्लैहल्लाको देश हो। हल्लाका भरमा रातारात बजारभरिबाट मास्क र स्यानिटाइजर गायब पारिन्छ। https://t.co/ujSv6gAbWg, Mar 07 2020 
दाङका एक जनाको घटनास्थलमै मृत्यु https://t.co/Wf5eVksVVK, Mar 07 2020 
वसन्त ऋतुको रंगीन पर्व फागु https://t.co/OC1w0rdP3S, Mar 07 2020 
अझै बेला भएको छैन ? https://t.co/94UHfS1BOf via @Annapurna_Post सिमाना पौडेलको अनुभूति, Mar 07 2020 
चन्द्रशेखर अधिकारी लेख्छन् : इराक-इरान युद्ध र एल साल्भाडोरको गृहयुद्ध हुँदा संयुक्त राष्ट्रसंघको महासचिव रहेका उनले रचनात्मक भूमिका निर्वाह गर्न सक्थे तर उनी शक्ति राष्ट्रको छायामा परे। https://t.co/CrPO7noD64, Mar 07 2020 
६५ रोपनी गौचरण निजी कामय https://t.co/Dhzz0bvloQ, Mar 07 2020 
नेताहरूलाई किताब सिफारिस गर्नु बेकार छ https://t.co/wtiGoBwUjL via @Annapurna_Post सावित्री गौतमसँगको फुर्सद–वार्ता, Mar 07 2020 
बागमती सरकारलाई कर्मचारी संगठन निजामतीको ३५ बुँदे मागपत्र https://t.co/K0giDhyRB5, Mar 07 2020 
भैरहवामा आयात र असुली घट्यो https://t.co/tT4ZqD4j2D, Mar 07 2020 
नेपाली कार्पेटसँग ६० वर्षे साइनो https://t.co/nLG2QTIUKr, Mar 07 2020 
महानगरले बजेट खर्च गर्न सकेन https://t.co/6CkVDkVJjl, Mar 07 2020 
कोरोनाले एसियाली अर्थतन्त्रमा पहिरो https://t.co/ZUkxkLfa5T, Mar 07 2020 
छोरीहरूको छहारी https://t.co/dIzE2vgSaH via @Annapurna_Post अन्नपूर्ण फुर्सदमा प्रकाशित जयन्ती गौडेलको नारी विशेष लेख, Mar 07 2020 
