Tweet,Date
ठेकेदारको लापरवाहीले रिठापाटा-सुर्मा सडक निर्माण रोकियो https://t.co/LpPTE6XLjb via Annapurna Post, Feb 27 2020 
पेट्रोल र डिजेलमा प्रतिलिटर १० रुपैयाँ विकास कर लगाउने सरकारको निर्णय https://t.co/6pCmywxBt9, Feb 27 2020 
'बालुवाटार बबन्डर' ले सेयर बजार हल्लिएन अहिलेसम्मकै उच्च कारोबार नेप्से १६३२ पुग्यो https://t.co/vlzv7hypeX via @Annapurna_Post, Feb 27 2020 
मक्‍का र मदिना भ्रमणमा विदेशीलाई प्रतिबन्ध https://t.co/89PjlTMyIq, Feb 27 2020 
रवीन्द्र अधिकारीको त्यो अधुरो वाचा... https://t.co/LWiCsvwrPy, Feb 27 2020 
भारतले गर्‍यो कोरोना संक्रमित पानी जहाजबाट नेपालीसहित १२४ को उद्धार https://t.co/Vp87YwTEqt via @Annapurna_Post, Feb 27 2020 
सुत्केरी आमा र बच्‍चाको मृत्युपछि बिपी प्रतिष्ठान तनावग्रस्त https://t.co/p3nT37PWmU, Feb 27 2020 
मन्त्रीलाई सांसदको प्रश्‍न : बाँदरले आतंक मच्‍चायो https://t.co/K5H56z2x0x, Feb 27 2020 
‘अब पनि एमाले र माओवादी भन्‍ने हो भने दुर्घटना हुन्छ’ https://t.co/sb9kX0vbc3 via @Annapurna_Post, Feb 27 2020 
दिल्ली हिंसामा मृत्यु हुनेको संख्या ३२ पुग्यो https://t.co/fN0xZaAnqB via Annapurna Post, Feb 27 2020 
सिपी मैनाली चढेको कार दुर्घटना https://t.co/k1nNDWOTnC, Feb 27 2020 
बागमती प्रदेश ईञ्चार्ज अष्टलक्ष्मी शाक्यले प्रधानमन्त्री केपी ओलीको जन्मदिनमा केक काटेको विषयमा आपत्ति जनाएकी छन् । https://t.co/FT4cNbDN7c via @Annapurna_Post, Feb 27 2020 
संसदमा प्रश्‍न : नागरिकता विधेयक कहाँ अड्कियो ? https://t.co/w2FzOHmTRk via Annapurna Post, Feb 27 2020 
पाठ्यक्रम व्यवहारिक हुनुपर्छ https://t.co/lLTdzpnlnh, Feb 27 2020 
लुम्बिनीमा साझा पार्टीको राष्ट्रिय भेला सुरू हुँदै https://t.co/xhizwqoqr2 via @Annapurna_Post, Feb 27 2020 
‘बालुवाटार बबन्डर’पछि ओली प्रचण्ड र माधव एउटै मञ्चमा https://t.co/6qCYEpqkaY via @Annapurna_Post, Feb 27 2020 
इटालीमा कोरोना भाइरस ह्‍वात्तै फैलियो ४ सय संक्रमित https://t.co/UZMKX57R8Y, Feb 27 2020 
सुनको मूल्य फेरी बढ्यो https://t.co/G9eNrZFoal via Annapurna Post, Feb 27 2020 
अमेरिकी बियर कम्पनीमा अन्धाधुन्ध गोली प्रहार ५ मारिए https://t.co/U1xEIRbyGN, Feb 27 2020 
पुल हाउसमा चरेशको कारोबार दुई पक्राउ https://t.co/izka0OI6FG via Annapurna Post, Feb 27 2020 
वडा अध्यक्षसहित ४ जनाविरुद्ध भ्रष्टाचार मुद्दा https://t.co/7iCNpGJFbU via Annapurna Post, Feb 27 2020 
दार्चुलामा राष्ट्रपतिलाई नागरिक अभिनन्दन https://t.co/Fb8CO968pv via @Annapurna_Post, Feb 27 2020 
आजदेखि मौसम सुधार हुने https://t.co/Sp9LOTo1bd, Feb 27 2020 
प्रधानमन्त्री र शेखर कोइरालाबीच बालुवाटारमा भेटवार्ता https://t.co/T2wxEOtvY0, Feb 27 2020 
प्रतिनिधिसभा बैठक बस्दै : के छ कार्यसूची ? https://t.co/aPAUOuj8ip via Annapurna Post, Feb 27 2020 
तस्करीको तारोमा बालबालिका https://t.co/BWmk7o5CC0, Feb 27 2020 
चितुवाको आक्रमणबाट बालक घाइते https://t.co/PJZM3g9qCY, Feb 27 2020 
अन्‍नपूर्ण पोस्टको आजको कार्टुन https://t.co/JXCIBNsC1S, Feb 27 2020 
विभेदकारी भीसा नीति https://t.co/SQ6K1MLLuf, Feb 27 2020 
अपराध पीडितमैत्री संविधान ? https://t.co/HSfcfHE8Cs, Feb 27 2020 
भारतमा दुई नेपाली नाटक https://t.co/BiAXjy2GoM, Feb 27 2020 
इण्डोनेशियामा बाढीपहिरोले १० हजार विस्थापित https://t.co/K03mYHBxad, Feb 27 2020 
दिल्ली हिंसामा २२ को मृत्यु https://t.co/7K5l9knF4S, Feb 27 2020 
मौलिकता गुमाउँदै सम्पदा क्षेत्र https://t.co/lpJmTcegIk, Feb 27 2020 
नेपालमा पनि एक्जिम बैंक ! https://t.co/fbeEeM3JHy, Feb 27 2020 
नेपालको नक्सामा लिम्पियाधुरालाई समेट्न विज्ञको दबाब https://t.co/sMe2xrw3Qe, Feb 27 2020 
बामदेवलाई रोक्न खोज्दा नेकपामा बबण्डर https://t.co/xC6nyB54IV, Feb 27 2020 
नियम छल्न कागजी उपभोक्ता निर्माणमा जनप्रनिधिकै डोजर https://t.co/ANn0a8RsIL, Feb 27 2020 
विप्लवको बन्दले पढाइमा अवरोध https://t.co/tP6ZzqGlFK, Feb 27 2020 
दुग्धजन्य शिशु आहारमा ‘विष’ लाखौं बालबालिका जोखिममा https://t.co/esUUYq6xq8, Feb 27 2020 
बालबालिकाले पिउने दुधमा विषाक्त पदार्थ ! https://t.co/iXmJsRksNf, Feb 27 2020 
गुप्‍तचरलाई फोन ट्यापिङ सुविधा https://t.co/J3QfZiiyXN, Feb 27 2020 
सुन बाँडीचुडी खाने सीमा चौकीका इन्स्पेक्टरसहित १६ प्रहरी निलम्बन गर्न अख्तियारको निर्देशन https://t.co/pDONr2BV70 via @Annapurna_Post, Feb 26 2020 
ट्रस्टको जग्गामा मलाई गाँस्नु गलत : देउवा https://t.co/D44BiM0mEW via @Annapurna_Post, Feb 26 2020 
जडिबुटी-सूर्यविनायक सडकमा लेन अनुशासन सुरु https://t.co/jJZ1upC2d4 via @Annapurna_Post, Feb 26 2020 
'वामदेव निर्णय माइन्यूट'पछि बालुवाटारमा बबन्डर ! https://t.co/jMWLqGTKo0, Feb 26 2020 
सीमा फिर्ता माग्दै रिले अनशन https://t.co/XGoGlBUEOA, Feb 26 2020 
पाठ्यक्रममा लिम्पियाधुरासहित नक्सा राख्न दबाब https://t.co/t99nblnv0j via @Annapurna_Post, Feb 26 2020 
वर्षाको चाँदी कटाइ https://t.co/K8EAdVxQPX, Feb 26 2020 
जडौली चप्पल लगाउने हामीसँग चिल्ला कार र महल कहाँबाट आए ? (भिडियो) https://t.co/81CfByw34x via @Annapurna_Post, Feb 26 2020 
विश्‍व साहित्य महोत्सव सुरु https://t.co/pugpatmWlC via Annapurna Post, Feb 26 2020 
कोरोना भाइरसको औषधि परीक्षण नेब्रास्कामा पनि शुरु https://t.co/gxhD1n1rCw, Feb 26 2020 
चटकको पराकाष्ठा https://t.co/jjUsJaAnmE, Feb 26 2020 
७० हजार घुससहित वडाध्यक्ष पक्राउ https://t.co/umVV2INQTf via Annapurna Post, Feb 26 2020 
इन्डो प्यासिफिकको दाउ https://t.co/1AGqcMfcdj, Feb 26 2020 
कार्यालय सहयोगी घुससहित पक्राउ https://t.co/BLHeaPimoe via @Annapurna_Post, Feb 26 2020 
सेयर बजारमा नयाँ रेकर्ड : सबा चार अर्बको कारोबार नेप्से १६ सय नजिक https://t.co/exW6Uh41NZ via @Annapurna_Post, Feb 26 2020 
पाण्डे सचिवमा बढुवा https://t.co/nYm2WTcMtL via @Annapurna_Post, Feb 26 2020 
विप्लवको एक पन्ने विज्ञप्तिले ८० लाख विद्यार्थीको पढाइ बिथोलियो https://t.co/HQQgrKD3ra via @Annapurna_Post, Feb 26 2020 
सरकार परिवर्तन भए देशमा अराजकता र अशान्ति फैलिन्छ : कमल थापा https://t.co/Fq7E7qpFJf via @Annapurna_Post, Feb 26 2020 
सुन चाँदीको मूल्य घट्यो https://t.co/fXrX80H6Ig via @Annapurna_Post, Feb 26 2020 
बाबुरामको टिप्पणी : सरकारका दुई वर्ष 'कागलाई बेल पाक्यो हर्ष न विस्मात' https://t.co/fdewW5Ir2T via Annapurna Post, Feb 26 2020 
वरिष्ठ उपाध्यक्षमा चन्द्र ढकालको उम्मेदवारी महासंघलाई साझा चौतारी बनाउने संकल्प https://t.co/izK0hmsfh9 via @Annapurna_Post, Feb 26 2020 
मेसीपुत्रको फुटबल मोह https://t.co/mPDDBgJaGn, Feb 26 2020 
‘खेलाडीविरुद्ध आक्रामक’ बार्सिलोना https://t.co/wOFDNuksbN, Feb 26 2020 
प्रजातन्त्रको सुसाइड नोट https://t.co/qo5yA2sHiY, Feb 26 2020 
वामदेवलाई राष्ट्रियसभामा ल्याउने सचिवालयको निर्णय https://t.co/SQr6mplXeg via Annapurna Post, Feb 26 2020 
दिल्ली हिंसा जटिल मोडमा : मर्नेको संख्या २० पुग्यो सेना परिचालनको माग https://t.co/8hhqAo8AwY via @Annapurna_Post, Feb 26 2020 
ओली-प्रचण्ड भेटवार्तापछि बालुवाटारमा नेकपा सचिवालयको बैठक https://t.co/L8R8kCh9uz via @Annapurna_Post, Feb 26 2020 
देशका आमाहरूको कथा https://t.co/6ypnyVXdEG, Feb 26 2020 
प्रतिनिधिसभा बैठक बस्दै के छन् एजेन्डा? https://t.co/JxLyRFhm7J via Annapurna Post, Feb 26 2020 
मौसममा कहिले सुधार आउला ? https://t.co/rBYiVlSszO via Annapurna Post, Feb 26 2020 
युरोपमा इटालीबाट फैलियो कोरोना भाइरस https://t.co/mhS6cW1w0q, Feb 26 2020 
एक वर्षदेखि राजमार्ग छेउमा रोकिएको ट्रक कस्को ? स्थानीय सशंकित https://t.co/E4Olx0fDfZ, Feb 26 2020 
धनगढीमा तीन साहित्यकारको शालिक https://t.co/ku5rhKzym7 via Annapurna Post, Feb 26 2020 
राष्ट्रपतिको स्वागतमा सार्वजनिक बिदा https://t.co/XgWyhwWmfd via Annapurna Post, Feb 26 2020 
दिल्ली झडपमा मर्नेको संख्या १८ पुग्यो (अपडेट) https://t.co/pQZXh2D5md via @Annapurna_Post, Feb 26 2020 
चिनी उद्योगको बदमासी : प्रतिवेदन गुपचुप https://t.co/tlot2VILR0, Feb 26 2020 
पर्यटक बढाउन चिनियाँको विकल्प खोजिँदै https://t.co/JliVNw66jQ, Feb 26 2020 
कोरोना रोक्न बेलायतमा पूर्वतयारी https://t.co/Yn73otimsL via @Annapurna_Post, Feb 26 2020 
जन्तीअगावै घरमै पुगे प्रहरी र प्रतिनिधि https://t.co/ySHN9NOAfk via @Annapurna_Post, Feb 26 2020 
सपना सधैं बिक्दैन https://t.co/pzUdw1DhGB via @Annapurna_Post, Feb 26 2020 
चिनियाँ अर्थतन्त्रमा कोरोना https://t.co/KcmrESzGux via @Annapurna_Post, Feb 26 2020 
हामीले अँगालेको निर्वाचन प्रणाली महँगो हुँदै गएको छ पैसाविना निर्वाचन जित्ने त निकै परको कुरा भयो उम्मेद्वारी समेत दिन नसकिने अवस्था छ https://t.co/DnsD0QYWwD via @Annapurna_Post दिपेश घिमिरेको विचार, Feb 26 2020 
डरलाग्दो व्यापार घाटा https://t.co/O6WXrjEBgq via @Annapurna_Post, Feb 26 2020 
ढल व्यवस्थित नहुँदा बजार दुर्गन्धित https://t.co/hvaCT2JtH4 via @Annapurna_Post, Feb 26 2020 
लिभरपुलको कीर्तिमानी बराबरी https://t.co/2BRr1k0WzP, Feb 26 2020 
हनुमन्ते करिडोर चेपुवामा https://t.co/Jlr2oNAbie via @Annapurna_Post, Feb 26 2020 
प्रदेश दरबन्दी किटानपछि प्रहरी समायोजन https://t.co/UvnyouQWOr via @Annapurna_Post, Feb 26 2020 
च्याम्पियन्स लिग : बार्सिलोना बराबरीमा चेल्सीको फराकिलो हार https://t.co/stadjHCv7t, Feb 26 2020 
भारतीय राजदूत र सार्क महासचिव आउँदै https://t.co/aZdtN9KAkp via @Annapurna_Post, Feb 26 2020 
ट्रस्टको जग्गा भाडा पूर्वसरकारहरूबाटै https://t.co/7ix7NU1E7k via @Annapurna_Post, Feb 26 2020 
त्रासमा दक्षिण कोरिया https://t.co/bIsKIMaXiw via @Annapurna_Post, Feb 26 2020 
बेपत्ताको विस्तृत छानबिन रोल्पाबाटै https://t.co/4w3jt9PSfI via @Annapurna_Post, Feb 26 2020 
वैज्ञानिकलाई पनि लाइसेन्स https://t.co/D2z9kAnE45 via @Annapurna_Post, Feb 26 2020 
सेलिब्रेटीले भरिभराउ ‘माया जदौ’ https://t.co/dwJQQbqa64, Feb 26 2020 
जयाको जीवन ‘फर्केर हेर्दा’ https://t.co/eXjSUnFA00, Feb 26 2020 
४० देशको शान्ति सेनाको नेतृत्वमा नेपाल : मिसन प्रमुख एवम् फोर्स कमान्डरको जिम्मेवारी उपरथी ईश्वर हमाललाई https://t.co/71kFkr035q via @Annapurna_Post, Feb 26 2020 
शान्ता बोल्दा भावुक दर्शक ! https://t.co/ANXx11qgfn, Feb 26 2020 
मलाइकाको फोटोमा फराहको अपशब्द https://t.co/KntBnfMv8C, Feb 26 2020 
आजको कार्टुन @Annapurna_Post https://t.co/7nxTuz6XQy, Feb 26 2020 
१८ वर्ष बित्यो ३ पिलर मात्रै https://t.co/70sN9NL9vg via @Annapurna_Post, Feb 26 2020 
सन्दीप लामिछानेलाई दुर्लभ अवसर : एसिया—११ बाट विश्व—११ विरुद्ध खेल्ने https://t.co/PBmPFTySqO via @Annapurna_Post, Feb 26 2020 
पार्टी विधान संशोधन गरेर उपाध्यक्ष। त्यसअघि नै संगठन विभाग प्रमुख। राष्ट्रियसभामार्फत प्रधानमन्त्रीको हकदार बनाउन देशकै संविधान संशोधनको गृहकार्य। आखिर वामदेव गौतमको ‘तागत’ के हो? https://t.co/pOQYAwESP0 via @Annapurna_Post, Feb 26 2020 
अमेरिकी नीतिमा भारतको साथ https://t.co/oVe9OQ8jG5 via @Annapurna_Post, Feb 26 2020 
दुई महिनापछि खुले विद्यालय https://t.co/IY9oTmTPd8 via @Annapurna_Post, Feb 25 2020 
दिल्लीको ह्यापीनेस पाठ्यक्रमबाट मेलानिया खुशी https://t.co/T3tLZM3a5P, Feb 25 2020 
विश्‍वभर आज : दिल्लीमा ट्रम्प कश्मीर विवाद मिलाउन तयार इस्तानबुल उडेको जहाज कोरोना सर्ने डरले ल्याण्ड गर्न दिइएन https://t.co/Lwg68NX3Hx, Feb 25 2020 
नेपाल ट्रष्टको श्वेतपत्र : प्रचण्ड देउवा बाबुरामदेखि वामदेव र गच्छदारसम्म जोडिए https://t.co/bhnkpYmX5D via @Annapurna_Post, Feb 25 2020 
राष्ट्रियसभा सदस्यको शपथ फागुन २१ गते https://t.co/kkTJQ08oNc via @Annapurna_Post, Feb 25 2020 
कम्युनिस्ट अधिनायकवादविरुद्ध कांग्रेसको अन्तिम लडाइँ : देउवा https://t.co/jrIWNP1g6z, Feb 25 2020 
ट्रम्पले दिल्लीबाट भने : भारत-पाकिस्तान मध्यस्थता गर्न तयार छु https://t.co/192HcW1ViS, Feb 25 2020 
गण्डकी प्रदेशले माग्यो नेपाल ट्रस्टको जग्गा https://t.co/iYTCLC0KwV via @Annapurna_Post, Feb 25 2020 
इन्डोनेसियामा बाढी राष्ट्रपति भवनसहित राजधानी जलमग्‍न https://t.co/BVw5DXswjF, Feb 25 2020 
फेवामा शव भेटियो https://t.co/6jow1Kr6mi via @Annapurna_Post, Feb 25 2020 
इस्तानबुल उडेको जहाज कोरोनाको त्रासले अन्यत्रै ‘डाइभर्ट’ गरियो https://t.co/rvgL5cxMyr, Feb 25 2020 
प्रधानसेनापति कप टीट्वेन्टी : अक्षरा अन्तिम चारमा https://t.co/p8ZY8m1y3P, Feb 25 2020 
नेपाल ट्रष्टको सम्पत्ति कति ? सरकारले जारी गर्‍यो श्वेतपत्र https://t.co/cZgnF5HaLv via @Annapurna_Post, Feb 25 2020 
सुनितालाई पूर्वन्यायाधीशको सहयोग https://t.co/3kvYXocfxw via @Annapurna_Post, Feb 25 2020 
'स्‍नातकपछि छोराछोरी पढाउन खर्च गर्दिनँ' https://t.co/tZ7IBJsjgV, Feb 25 2020 
इजिप्टमा ३० वर्ष शासन चलाएका होस्‍नी मुबारकको निधन https://t.co/MIsF3SUav6, Feb 25 2020 
गर्भभित्रैबाट बाबालाई चिठी https://t.co/I0cJ3rUkdX, Feb 25 2020 
एसिया ११ मा आईसीसी एसोसिएट राष्ट्रबाट सन्दीप लामिछाने https://t.co/eGd8RnaQVJ via @Annapurna_Post, Feb 25 2020 
निजी क्षेत्रलाई नियमन गर्ने कि खुला गर्ने द्विविधामा छु : अर्थमन्त्री https://t.co/M0iOujjPDi, Feb 25 2020 
नेप्सेमा उछाल ४३ अङ्कको वृद्धि https://t.co/DDmaOlF6cE via @Annapurna_Post, Feb 25 2020 
ट्रम्पले सचिन तेन्दुल्कर र विराटको नाम गलत उच्चारण गरेपछि... https://t.co/2EiEcShttm, Feb 25 2020 
सांसदले कविता भन्दै मागे प्रधानमन्‍त्रीको राजीनामा (भिडियो) https://t.co/oHnSCpy9FP via @Annapurna_Post, Feb 25 2020 
अछाममा जिप दुर्घटना : एकको मृत्यु https://t.co/3YDDg2FVr1 via @Annapurna_Post, Feb 25 2020 
‘गुप्तचर’विधेयकको छलफलमा पत्रकारलाई प्रवेश निषेध ! https://t.co/uErTqutOE7 via @Annapurna_Post, Feb 25 2020 
अझै तीन दिन मौसम सफा नहुने https://t.co/loSBtL6p57, Feb 25 2020 
नेपालीहरु रहेको कोरियाली सहर कोरोनाका कारण बन्द https://t.co/j2wDrqPpl2, Feb 25 2020 
सरकारका गतिविधिप्रति राप्रपाको चिन्ता 'व्यक्तिका लागि संविधान संशोधन गलत' https://t.co/to1U0plIBp via @Annapurna_Post, Feb 25 2020 
चीनमा सूचना चुहाएको भन्दै पुस्तक व्यापारीलाई १० वर्ष जेल https://t.co/S5hbMDM7cb, Feb 25 2020 
पाथिभरा म्याराथनको उपाधि सुमन र सुनमायालाई https://t.co/erPIHnbpdv via @Annapurna_Post, Feb 25 2020 
महानगरले सुकुम्बासीका टहरा भत्काउँदा झडप https://t.co/60rtYkNSrD via @Annapurna_Post, Feb 25 2020 
ट्रयाक्टर दुर्घटना हुँदा नौ जना घाइते https://t.co/xf9u4TVKi9, Feb 25 2020 
‘ओलीको बर्थडेले ज्ञानेन्द्रको न्यास्रो मेटायो’ https://t.co/6BTJayySx0, Feb 25 2020 
'विश्वविद्यालयलाई कार्यकर्ता भर्तीकेन्द्र बनाउन खोजियो' https://t.co/PgnrG4WZ7t, Feb 25 2020 
संसदमा प्रधानमन्त्रीलाई प्रश्‍न : नेपालको नक्सा काटेर किन बर्थडे मनाएको ? https://t.co/co1rVjsoBD via Annapurna Post, Feb 25 2020 
'गान्धीको दृष्टिकोणमा अमेरिका उभिन्छ' https://t.co/ANWujPNZKb, Feb 25 2020 
सतबाँझ-दार्चुला सडक निर्माण किन रोकियो ? https://t.co/C4qweZLCun via Annapurna Post, Feb 25 2020 
सुनको भाउ घट्यो https://t.co/Kv1Tfj1haW, Feb 25 2020 
मोदी ट्रम्पसँग व्यस्त : दिल्लीको हिंसात्मक प्रदर्शनमा पाँचको मृत्यु https://t.co/2lb3aUVg47, Feb 25 2020 
विप्लवका इन्चार्ज पुनः पक्राउ https://t.co/BKjwfUcIJv, Feb 25 2020 
कर्णालीका किसानको ऋणको ब्याज सरकारले तिरिदिने https://t.co/rCD4E8zlRS, Feb 25 2020 
ईश्वी संवतबारे सोच्ने कि ? https://t.co/r2nVmqZsjK, Feb 25 2020 
आठ घन्टापछि खुल्यो वीपी मार्ग https://t.co/Tr6m0MLsW9, Feb 25 2020 
अभाव टार्न स्वयंमसेवक शिक्षक खटाइँदै https://t.co/LfQwhK0rZz, Feb 25 2020 
विद्युतको हाइटेन्सन टावरमुनी नाली https://t.co/7TufyVgpS1 via Annapurna Post, Feb 25 2020 
कोरोना संक्रमण : चीनमा घट्दै अन्य मुलुकमा बढ्दै https://t.co/sDgeWAkEyk via Annapurna Post, Feb 25 2020 
प्रतिनिधिसभा बैठक बस्दै के छन् एजेन्डा ? https://t.co/W7XQ6gRblK via Annapurna Post, Feb 25 2020 
कर्णालीमा जीप खस्यो चालक बेपत्ता https://t.co/4qxN6ZxPaY via Annapurna Post, Feb 25 2020 
दुर्घटनामा दुईको मृत्यु दुई घाइते https://t.co/d4qKA0c3j3 via Annapurna Post, Feb 25 2020 
