Tweet,Date
कोरोना संक्रममणबाट स्पेनकी राजकुमारीको निधन https://t.co/aGNfiYtf6u via @Annapurna_Post, Mar 28 2020 
कोरोना महामारीको पछिल्लो अवस्था : कुन देशमा कतिको मृत्यु कति संक्रमित ?(सूचीसहित) https://t.co/JYZ1zCAx8F, Mar 28 2020 
के पत्रिकाबाट सर्छ कोरोना भाइरस ? https://t.co/PLktgha9yS, Mar 28 2020 
कोरोनाबारे सूचना दिन सेनाले बनायो मोबाइल ‘एप’ https://t.co/wBdDkg6jHF via @Annapurna_Post, Mar 28 2020 
खाद्यान्न चाहियो ? भाटभटेनीलाई फोन गर्नुहोस्... https://t.co/Pv62IlWYR3 via Annapurna Post, Mar 28 2020 
आधाबाटोमा चीनले नै रोक्यो कोरोना परीक्षण ‘किट’ https://t.co/XALyVRx2KY via @Annapurna_Post, Mar 28 2020 
धमाधम बन्दै क्वारेन्टाइन र आइसोलेसन उपचारको तयारी शून्य https://t.co/dWDAz7ipQ2 via Annapurna Post, Mar 28 2020 
भारतबाट दैलेख आए ९ सय https://t.co/3RpHmwvm1o, Mar 28 2020 
कोरोना नियन्त्रण : सुदूरपश्चिम प्रदेशमा ४० करोडको कोष https://t.co/Lv6AVNcJ16 via Annapurna Post, Mar 28 2020 
तस्बिरमा लकडाउनको पाँचौ दिन : कोरोना त्राससँगै किनमेलमा भिडभाड https://t.co/e5mYMZijoh via @Annapurna_Post, Mar 28 2020 
गुल्मीमा ३१ जना क्वारेन्टाइनमा https://t.co/2oGiECCzu3 via Annapurna Post, Mar 28 2020 
लकडाउनको अवज्ञा गर्दै हाटबजार सञ्‍चालन https://t.co/wgeYvM7Lr7, Mar 28 2020 
ग्लोब्स र मास्क कालोबजारी गर्ने पक्राउ https://t.co/z3fYvUVNgu via Annapurna Post, Mar 28 2020 
आइसोलेसन वार्डबाटै बिरामी फरार https://t.co/NlS3bToASE via @Annapurna_Post, Mar 28 2020 
रामेछापमा क्‍वारेन्टाइनमा बस्‍नेको संख्या ५४ पुग्यो ४५ बेडको आइसोलेसन तयार https://t.co/baELzdIhFF via @Annapurna_Post, Mar 28 2020 
कोरोना महामारीसँगै कन्डमको अभाव सुरु https://t.co/tpPPKv61gy, Mar 28 2020 
प्रधानमन्‍त्रीलाई साझा पार्टीको खुलापत्र https://t.co/4MVIww4dSb via @Annapurna_Post, Mar 28 2020 
कोरोना धपाउन कुखुरा काटेर प्राकृतिक पूजा ! https://t.co/1RfHBy6YmD via @Annapurna_Post, Mar 28 2020 
‘कांग्रेसको सहयोगले सरकारलाई ऊर्जा’ https://t.co/ZbzyOkaIIP via @Annapurna_Post, Mar 28 2020 
वीरगन्ज महानगरले घर-घरमा खाद्यान्न पुर्‍यायो https://t.co/i0IPB5jUlV via @Annapurna_Post, Mar 28 2020 
विदेशबाट आएका ८० जना भक्तपुर प्रहरीको निगरानीमा https://t.co/Gq0XMJ7LJV via @Annapurna_Post, Mar 28 2020 
उनको बुवा आमा बेल्जियममै छन्। https://t.co/I8xel4e7Mx, Mar 28 2020 
संयुक्त राष्ट्रसंघका ८६ कर्मचारी कोरोना संक्रमित https://t.co/7zZdtwbCBD via @Annapurna_Post, Mar 28 2020 
संक्रमण–विशेषज्ञ डाक्टरले नै फैलाइन् संक्रमण https://t.co/cpuvWjfm5m, Mar 28 2020 
अमेरिकामै किन यति छिटो फैलिँदैछ कोरोना कहाँ चुक्यो शक्तिशाली देश ? https://t.co/8cssIQfcrP, Mar 28 2020 
बेल्जियमबाट आएकी अर्की युवतीमा पनि देखियो कोरोना https://t.co/AlV1b0H5TX, Mar 28 2020 
प्रदेश १ : २५ को कोरोना परीक्षण २० को रिपोर्ट ‘नेगेटिभ’ https://t.co/29CD76T5NS via @Annapurna_Post, Mar 28 2020 
मदिराले उठिबास https://t.co/SEz6xbBbEg, Mar 28 2020 
‘खानेकुरा नभए वडाध्यक्षलाई फोन गर्नुस् ’ https://t.co/sLJ0j8m6cV via @Annapurna_Post, Mar 28 2020 
लकडाउनमा खुलेको सफा आकाश (फोटो फिचर) https://t.co/Y7IA2atIbW via @Annapurna_Post, Mar 28 2020 
'भगवान'को घरमा कोरोनाको डर https://t.co/qF5eEujLrj, Mar 28 2020 
कोरोना परीक्षणका लागि आवश्यक सामग्री लिन चीन उडेको जहाज https://t.co/gFgP6Z0Vyk via @Annapurna_Post, Mar 28 2020 
अण्डाबाट बनाइन्छ खोप के कोरोना भाइरसको खोप पनि सम्भव छ ? https://t.co/bwteuwIvDQ, Mar 28 2020 
संक्रमितसँगै आएका २ जना गाउँ डुल्दै ३ जना सम्पर्कविहीन https://t.co/loTqKFgvkL, Mar 28 2020 
पोखरामा लकडाउन उल्लंघन गर्नेहरु भलिबल कोर्टमा थुनिए https://t.co/zQxDhUeJSb via Annapurna Post, Mar 28 2020 
नेपालमा कोरोना संक्रमित थपिए : १९ वर्षीया युवतीमा पोजेटिभ https://t.co/eoYyV1Go4R via @Annapurna_Post, Mar 28 2020 
बागलुङकी युवतीमा कोरोना संक्रमण भएको पुष्टि https://t.co/TnsnwwMJ41, Mar 28 2020 
आइसोलेसनमा राखिएका युवक 'डिस्चार्ज' https://t.co/2nTI4slTpn, Mar 28 2020 
राहत प्याकेज ल्याउन श्रमिकको तथ्याङ्क संकलन https://t.co/8FvEMIg96e, Mar 28 2020 
कञ्‍चनजंघा क्षेत्रमा ११ पर्यटक रोकिए https://t.co/Tx5MBdWWpc via Annapurna Post, Mar 28 2020 
ज्याला मजदुरलाई दैनिक खाद्यान्‍न सहयोग https://t.co/ZYMZRreeox via @Annapurna_Post, Mar 28 2020 
चार दिनपछि उठ्‍न थाल्यो उपत्यकाको फोहोर https://t.co/fYSp1nn9Ch via @Annapurna_Post https://t.co/JCfPXTMf09, Mar 28 2020 
लकडाउनमा खुलेको आकाश https://t.co/pGyLhAD8Lc via @Annapurna_Post, Mar 28 2020 
प्रचण्डको भिडियो सन्देश : उच्च मनोबलले मात्रै कोरोनाविरुद्धको लडाईं जित्छौं https://t.co/VWqhLsP99F, Mar 28 2020 
भिडियोमा कोरोना भाइरस सतर्कताका लागि प्रचण्डको अपील https://t.co/Dc34oa3Pqw via @Annapurna_Post, Mar 28 2020 
सामान छुटाउन एजेन्ट नआएपछि ८६ कन्टेनर वीरगन्जमा अलपत्र https://t.co/682ay2Eifv via @Annapurna_Post, Mar 28 2020 
३८ लाख ग्राहकलाई विद्युत् महसुलमा छुट दिने निर्णय https://t.co/TNfhKfg35l, Mar 28 2020 
विपन्‍न मजदुरलाई नगरपालिकाले खाना खुवाउन थाल्यो https://t.co/BS3lbb5a9j, Mar 28 2020 
गरिब देशबारे अन्तर्राष्ट्रिय मुद्रा कोषको चासो https://t.co/Rt3opHU3dv, Mar 28 2020 
लोमान्थाङमा बल्ल पुग्यो माक्स https://t.co/fO1siuGNdA, Mar 28 2020 
सामान छुटाउन एजेन्ट नआएपछि : ८६ कन्टेनर वीरगन्जमा अलपत्र https://t.co/682ay2Eifv via @Annapurna_Post, Mar 28 2020 
अमेरिकी सरकारले प्रत्येक करदतालाई १२ सय डलर दिने https://t.co/17zLAqPgsN via @Annapurna_Post, Mar 28 2020 
ओखलढुंगामा ८८ बेडको क्वारेन्टाइन तयार https://t.co/7ZS3OCelVl via @Annapurna_Post, Mar 28 2020 
लकडाउनले मजदुर समस्यामा : सुकुम्बासी बस्तीमा वडाअध्यक्षले वितरण गरे खाद्यान्‍न https://t.co/KccCDcWdv4, Mar 28 2020 
कोरोना कोषलाई अख्तियारका आयुक्तको १५ दिनको तलब सहयोग https://t.co/qDlDd6bQMc via Annapurna post., Mar 28 2020 
आजदेखि मौसम सुधार https://t.co/JYX4aK0uFQ via @Annapurna_Post, Mar 28 2020 
डब्लूएचओ प्रमुख भन्छन् : गरिब देशका स्वास्थ्यकर्मी पनि धनी देश जत्तिकै सुरक्षाका लागि योग्य छन् https://t.co/octU0fx4XV, Mar 28 2020 
दुर्घटना हुनबाट जोगिएको बिमानमा को को थिए ? (अपडेट) https://t.co/r0G338dk1L via Annapurna Post, Mar 28 2020 
नेपालगञ्‍ज विमानस्थलमा विमान चिप्लिएपछि.. https://t.co/JN3ypWbWgu via @Annapurna_Post, Mar 28 2020 
मुस्कानलाई एसिड छयाप्ने अभियुक्त रिहा https://t.co/h4FKAJ4Aaa, Mar 28 2020 
कोरोना त्रास : बार लगाएर लकडाउन https://t.co/Uwarn4i2bD via @Annapurna_Post, Mar 28 2020 
लकडाउन : दुवै देशका नागरिक अलपत्र https://t.co/UenD1xQHDA via @Annapurna_Post, Mar 28 2020 
आइसोलेसनको ९६ घण्टा : 'रोगलेभन्दा आफन्तको व्यवहार र समाजको विभेदले गलायो' https://t.co/Wlv3iDRsZ4, Mar 28 2020 
बादी बस्तीमा छाकटार्ने समस्या https://t.co/yh63ldKSyK via @Annapurna_Post, Mar 28 2020 
लाखौं अमेरिकी बेरोजगार https://t.co/fyed3LMe2Y via @Annapurna_Post, Mar 28 2020 
प्रहरीलाई स्वास्थ्य सामग्री सहयोग https://t.co/lEZlCKeAW9 via Annapurna Post, Mar 28 2020 
फिलिपिन्सका सैन्य प्रमुख कोरोना संक्रमित https://t.co/9dR0N49Pbk, Mar 28 2020 
वीपी प्रतिष्ठानमा भर्ना भएका १६ जनाको कोभिड-१९ परीक्षण रिपोर्ट आयो https://t.co/Dn3ah3sBoN, Mar 28 2020 
काठ चोरीको आरोपमा पक्राउ https://t.co/RSipRJPOSm via @annapurnapost, Mar 28 2020 
‘सवारीको चाप नहुँदा कस्तो कस्तो लाग्ने रैछ’ https://t.co/KrHVGhBFFX, Mar 28 2020 
मेडिकल सामग्री लिन नेपाल एयरलाइन्सको विमान चीन जाँदै https://t.co/1vshPX98q9 via Annapurna Post, Mar 28 2020 
पर्यटक राखे ५० हजार जरिवाना https://t.co/fEUJmfYX7z, Mar 28 2020 
धनगढी कोरोना संक्रमित: परिवारका सदस्यको स्वाब संकलन हुँदै https://t.co/vywU7hGEEU via @Annapurna_Post, Mar 28 2020 
कोरोनाबारे भ्रम फैलाउने ३ वेबसाइट बन्द https://t.co/RHgYzfC4OF via @Annapurna_Post, Mar 28 2020 
कोरोनाबारे जानकारी दिन नयाँ वेब पोर्टल एप्लिकेसन आजदेखि संचालनमा https://t.co/l7VMg2Z150 via Annapurna Post, Mar 28 2020 
जब उर्जामन्त्रीले इन्डक्सन चुल्होका लागि मन्त्रालयका सचिवको सम्पर्क नम्बर दिए... https://t.co/jhXl0gpoEA, Mar 28 2020 
ठेक्का नलागेको बजेट फिर्ता गरी राहत https://t.co/UiBxIKJZaZ via @Annapurna_Post, Mar 28 2020 
कोरोना अपडेट : इटलीमा एकै दिनमा ९०० भन्दा बढीको मृत्यु https://t.co/ugdedPvDS6 via @Annapurna_Post, Mar 28 2020 
सहकारीले लिन छाड्यो दूध https://t.co/cwUF4Xq0m3 via @Annapurna_Post, Mar 28 2020 
आजदेखि प्रहरीको कडाइ बिहानै २०० नियन्त्रणमा https://t.co/HYaVrslEcY via @Annapurna_Post, Mar 28 2020 
सिकारमा हिँडेका युवाको गोली लागेर मृत्यु बन्दुकसहित ४ जना पक्राउ https://t.co/LmARXgvDjd via @Annapurna_Post, Mar 28 2020 
जनता भान्सा घर सञ्चालन गर्न माग https://t.co/OQhBdutlkT via @Annapurna_Post, Mar 28 2020 
खुला सिमानाको सकस https://t.co/Fj6wHu8m8X via @Annapurna_Post, Mar 28 2020 
कोरोनाबारे भ्रम : दलाई लामाको सन्देश भन्दै आँगन खन्दै गाउँले https://t.co/345MVCo8jP, Mar 28 2020 
कोरोनाविरुद्ध फिफा र डब्लूएचओको साझा अभियान https://t.co/sEO0b71Z1G via @Annapurna_Post, Mar 28 2020 
ओलम्पिक सर्दा फुटबल खेलाडीमाथि अन्याय : फुटबल खेलाडीको उमेर हद बढाउन माग https://t.co/wozDrJm6hD via @Annapurna_Post, Mar 28 2020 
‘केनले टोट्टनहाम छाड्न सक्छन्’ https://t.co/IexTomihmL via @Annapurna_Post, Mar 28 2020 
कोरोनाबाट २४ घण्टाभित्र बाबुछोरीको मृत्यु मलामी जाने कोही भएनन् https://t.co/xe1NfURVnz via @Annapurna_Post, Mar 28 2020 
कोरोना संक्रमितको उपचार गर्न नर्भिक अस्पताल तयार https://t.co/vWUCM1J4q7, Mar 28 2020 
कार्टुन @Annapurna_Post https://t.co/mpDNuS4pvE, Mar 28 2020 
विश्व फुटबलका सुपर स्टार मेसी र रोनाल्डोले कोरोना भाइरसको संक्रमणविरुद्ध लड्न सहयोग https://t.co/KhtfgBLQvm via @Annapurna_Post, Mar 28 2020 
नेपाल दुई स्थान खस्कियो https://t.co/NUNFr3dcVV via @Annapurna_Post, Mar 28 2020 
लकडाउनले टुटेको सम्बन्धमा सुधार https://t.co/RIsO9aP9Vg, Mar 28 2020 
आर्थिक प्रगति राम्रो हो तर चीनको इतिहास संस्कृति र परम्पराले दिएका महत्वपूर्ण खानपान रहनसहन सामाजिक व्यवहारको र विश्वलाई हेर्ने तरिका चटक्क छाडिदिनु गलत हो। https://t.co/60d8wwo5bM via @Annapurna_Post आदित्यमान श्रेष्ठको विचार, Mar 28 2020 
सुनसान विश्व रंगमञ्च दिवस https://t.co/yoefvl9bWs, Mar 28 2020 
यो समय छिट्टै बितिजान्छ। रातलाई दिनले उज्यालो बनाउने नियम पनि त प्रकृतिकै हो। यो सिकाइ हो सकस हैन।https://t.co/U7ydUmeGwc via @Annapurna_Post श्रेयज सुवेदीको विचार, Mar 28 2020 
कोरोना परीक्षणको नतिजा १० मिनेटमै https://t.co/rWcKFoHizD via @Annapurna_Post, Mar 28 2020 
यी हुन् कोरोना संक्रमित सेलिब्रिटी https://t.co/S2UUtrcQvB, Mar 28 2020 
प्रशंसाले उनीहरूमा आत्मविश्वास जगाइदिन्छ र थप ऊर्जा पनि दिन्छ। https://t.co/hMjyg0TTwN via @Annapurna_Post, Mar 28 2020 
इटालीमा पनि चीनभन्दा धेरै संक्रमित अमेरिकामा १ लाख नाघ्यो (कहाँ कति) https://t.co/mzTSqEbkhD via @Annapurna_Post, Mar 28 2020 
सार्क–सहकार्यमा पाकिस्तानको अड्को https://t.co/xhh6I3iXL9 via @Annapurna_Post, Mar 28 2020 
२० घण्टामा प्रधानमन्त्री डिस्चार्ज https://t.co/9rrCQxTsyC via @Annapurna_Post, Mar 28 2020 
आजको ई-पेपर https://t.co/IY9wKNdjcS @Annapurna_Post https://t.co/XORiw3aVKP, Mar 28 2020 
अमेरिकी सरकारको राहत प्याकेज पारित कसले कति पाउँछन् ? https://t.co/Hll6gq3C7n, Mar 28 2020 
यो लकडाउनले दिनगन्तीमा ज्याला लिएर छाक टार्ने गरिब जनतामा धेरै असर परेको छ। उनीहरूका लागि सरकारले तत्काल व्यवस्था गर्नुपर्छ। https://t.co/VP6nQSpCIv via @Annapurna_Post, Mar 28 2020 
कोरोना संक्रमित बेलायती प्रधानमन्त्रीले विश्राम नलिने https://t.co/Bg9QyeFNRH, Mar 28 2020 
नागरिकका समस्यामा खुकुलो बन्दै सरकार : अत्यावश्यक सामग्रीको उत्पादन र वितरण गर्नू https://t.co/A20E04PC4l via @Annapurna_Post, Mar 27 2020 
आठ तस्बिरमा कोरोना त्रासले फेरिएको दैनिकी https://t.co/o1f4RL9Qy0 via @Annapurna_Post, Mar 27 2020 
‘लकडाउन’मा निस्किए यसरी परिन्छ प्रहरी फन्दामा.. https://t.co/EUy3gYpN6R via @Annapurna_Post, Mar 27 2020 
डोटी जिल्ला अस्पताल भर्ना गरिएका बिरामीको रिपोर्ट नेगेटिभ https://t.co/qkyLbFR5Qm via @Annapurna_Post, Mar 27 2020 
कोरोनाबाट कुन देश कति प्रभावित ? डब्लुएचओको पछिल्लो तथ्यांक https://t.co/5L4dG54Elq, Mar 27 2020 
कोभिड-१९ महामारी : अख्तियार हिरासतमा रहेकालाई छाडिने https://t.co/9aQP4fdFmU, Mar 27 2020 
संक्रमितसँग आएका व्यक्ति क्‍वारेन्टाइनमा https://t.co/RbZgAwIs6u, Mar 27 2020 
सरकारलाई कांग्रेसको १७ सुझाव : भोलि होइन आजै गरौं https://t.co/sbg9g6f1Ue, Mar 27 2020 
कोरोना त्रास : चिकित्सकले छाडे जागिर https://t.co/MWZ6SfQVJ1, Mar 27 2020 
गोली भर्दाभर्दै पड्किएर हवल्दारको ज्यान गयो https://t.co/WcPwmnzSmD, Mar 27 2020 
नेपालमा अर्को एकजना कोरोना संक्रमित थपिए https://t.co/Jcrqdp5oMa via @Annapurna_Post, Mar 27 2020 
कहिले अन्त्य होला कोरोना कहर ? https://t.co/ZJKAO4Pqlg, Mar 27 2020 
कोरोनासँग जुध्‍न पार्टी कार्यकर्तालाई ओली-प्रचण्डले दिएको ७ बुँदे निर्देशनमा के छ ? https://t.co/K7QATyYGzl, Mar 27 2020 
प्रधानमन्त्री ओली डिस्चार्ज https://t.co/6sGa9LJ5XX via @Annapurna_Post, Mar 27 2020 
प्रहरीले कसरी गर्छ नछोएरै पक्राउ ? https://t.co/kSkexebTn4, Mar 27 2020 
कति सुरक्षित छन् सुरक्षाकर्मी ? https://t.co/04ErJzMKPO, Mar 27 2020 
पर्सामा सेना र तस्करबीच गोली हानाहान एकको मृत्यु https://t.co/jiuIMV22ht, Mar 27 2020 
विद्युतका ३८ लाख ग्राहकलाई महसुलमा २० प्रतिशत छुट https://t.co/vpaOPZqvId via @Annapurna_Post, Mar 27 2020 
बेलायती प्रधानमन्त्रीलाई पनि कोरोना संक्रमण https://t.co/szQjXgbYpK, Mar 27 2020 
विदेशबाट फर्किएका ७ जना क्‍वारेन्टाइनमा https://t.co/gwZng14yYz, Mar 27 2020 
चार्टर्ड जहाजमा ५८ पर्यटक पोखराबाट काठमाडौं उडे https://t.co/lycoxfyMzE via @Annapurna_Post, Mar 27 2020 
धादिङका ५ सांसदद्वारा कोरोना कोषमा १ महिनाको तलब जम्मा https://t.co/0jjWwxTSD4, Mar 27 2020 
कोरोना त्रास : जहाँ साबुन पानीले हात धोए मात्र टोलमा प्रवेश पाइन्छ https://t.co/hLiFYCwrGk via Annapurna Post, Mar 27 2020 
मजदुरलाई खाद्यान्न प्रहरीलाई मास्क https://t.co/TSQsNggf9Y via Annapurna Post, Mar 27 2020 
२० शैयाको क्‍वारेन्टाइन अलपत्र ११० जना डोल्पा पठाइँदै https://t.co/oFvnLrbP7e via Annapurna Post, Mar 27 2020 
घरमै पुगेर बिरामी लैजान सिडिओले दिए पास https://t.co/UQaUlzPYju, Mar 27 2020 
भारतबाट पाँचथर पुगेका दुईजना आइसोलेसनमा https://t.co/OSV6EXDN1c via @Annapurna_Post, Mar 27 2020 
कोरोना जोखिम : अलमलमा स्थानीय सरकार https://t.co/XYO8QAgatv via Annapurna Post, Mar 27 2020 
भोकै अलपत्र परेका रिक्सा चालकलाई खाद्यान्न बाढ्दै युवा https://t.co/8qspSBfFxR, Mar 27 2020 
कोरोना नियन्‍त्रणमा खट्ने स्वास्थ्यकर्मी र सुरक्षाकर्मीलाई कर्णालीमा थप सुविधा https://t.co/cTSVwBtJ1L via @Annapurna_Post, Mar 27 2020 
लकडाउन थप कडाइ : प्रहरीको विशेष टोली परिचालन https://t.co/t7mJJmYo3I, Mar 27 2020 
चीन-अमेरिका वार्ता : कोरोना महामारीविरुद्ध मिलेर काम गर्न तयार https://t.co/apadQFY0GM, Mar 27 2020 
दुई स्पेनी नागरिक दुई महिनादेखि गोरखाको घ्याच्चोकमा https://t.co/WDv1ynJd54 via @Annapurna_Post, Mar 27 2020 
३०७ पर्यटक लिएर फर्कियो कतार एयरलाइन्सको जहाज https://t.co/DwtT2CviZV via Annapurna Post, Mar 27 2020 
अब बजारमा आधा भरेको ग्यास पाइने https://t.co/XaOo4hChFb, Mar 27 2020 
स्वास्थ्यकर्मीलाई सुरक्षा सामग्री उपलब्ध गराउन सरकारसँग चिकित्सक संघको माग https://t.co/YMxeHUTXbo via @Annapurna_Post, Mar 27 2020 
कोरोना त्रास : कालिकोटका देवताले लिन मानेन् बली https://t.co/dUO1Lbjabj via @Annapurna_Post, Mar 27 2020 
कोरोना कहर : जहाँ अपरिचित व्यक्तिलाई निषेध छ https://t.co/aVR9iR6lyN, Mar 27 2020 
