Tweet,Date
कोरोना आशंका : चौतर्फी आलोचनापछि बिरामी अस्पताल भर्ना (अपडेट) https://t.co/Yp7GJm6Qg4 via Annapurna Post, Mar 20 2020 
हेटौंडा अस्पतालमा २ सय २९ शैयाको आइसोलेशन कक्ष निर्माण गरिने https://t.co/sJzVaWLtvj via Annapurna Post, Mar 20 2020 
राष्ट्रियसभा बैठक अनिश्‍चितकालका लागि स्थगित https://t.co/79CVGWvob6 via Annapurna Post, Mar 20 2020 
तीव्र विकास मिथक मात्र https://t.co/MEidRwibmZ via @Annapurna_Post डा. गोविन्दबहादुर थापाको विचार, Mar 20 2020 
फोनको इन्टरसेप्सन हुनुपर्छ : विज्ञ https://t.co/T6vNs6vHkl, Mar 20 2020 
कोरोना संक्रमण : भारतीय सीमाबाट फैलिने जोखिम https://t.co/GAlUdMGADx, Mar 20 2020 
प्रजातन्त्रका पक्षमा गिरिजाप्रसादले मोलेको त्यो जोखिम https://t.co/RNuVfSaYK3 via @Annapurna_Post, Mar 20 2020 
कोरोना आशंका : उपचारमा आनाकानी https://t.co/wUghNLBXGQ, Mar 20 2020 
नरिसाउनुस् तपाईंहरूकै लागि हो’ https://t.co/SZWvdrc0SV, Mar 20 2020 
ज्येष्ठ नागरिकको निगरानीमा ध्यान दिने कि ? https://t.co/5P4zTQBVHA via @Annapurna_Post डा. जगदीशकुमार क्षेत्रीको विचार, Mar 20 2020 
सामूहिक बलात्कार गर्ने चार जनालाई ७ वर्षपछि फाँसी यस्तो थियो घटना https://t.co/MvJQMRlrat, Mar 20 2020 
कोरोना संक्रमण : स्वस्थ भइन् १०३ वर्षीया वृद्धा https://t.co/XEE2WMPOGK via @Annapurna_Post, Mar 20 2020 
चिनियाँ उद्योग चलाउन बाधा https://t.co/KgNPc3MB0U via @Annapurna_Post, Mar 20 2020 
आजदेखि ५ स्थानमा सुपथ मूल्य पसल https://t.co/UnfmcNbzp8, Mar 20 2020 
दोलखामा बन्द भएनन् विद्यालय https://t.co/B8GnEHH3vH via @Annapurna_Post, Mar 20 2020 
कोभिड-१९ भाइरसबाट मृत्यु : चीनलाई इटालीले उछिन्यो https://t.co/9ODpfnpE19, Mar 20 2020 
सानैदेखि नक्कली सरिता https://t.co/JO1a4lJZml via @Annapurna_Post, Mar 20 2020 
युवा नेतृत्वमा अशोक https://t.co/WZjnNbqDV3 via @Annapurna_Post, Mar 20 2020 
तिब्बत केन्द्रविन्दु भएर ५.९ म्याग्निच्यूडको भूकम्प गएको जनाएको छ। https://t.co/bFkbv96Po8, Mar 20 2020 
काठमाडौंमा भूकम्पको धक्का https://t.co/bFkbv96Po8, Mar 20 2020 
‘३ सय बिघा जग्गा भारतमा पारियो’ https://t.co/tlBEUNE40S, Mar 20 2020 
नारिता र दुबई उडान स्थगित https://t.co/DmAdU1UsNN via @Annapurna_Post, Mar 20 2020 
एसईईको प्रश्नपत्र टिनको बाकसमा सुरक्षा चिन्ता https://t.co/J2Ct9c62HU, Mar 20 2020 
संकटमा मात्र सम्झिने ‘उपभोक्ता कार्ड’ https://t.co/NbEbFeh2JE, Mar 20 2020 
साटिएनन् एक अर्बका चेक https://t.co/NISVl7fd88 via @Annapurna_Post, Mar 20 2020 
सार्क सहकार्यमा ओली सक्रिय https://t.co/bGrkJuqAho, Mar 20 2020 
पूर्वतयारी तीव्र : हजार आइसोलेसन बेड यस्तो छ नेपालको पछिल्लो अवस्था https://t.co/miBZAqnKMW, Mar 20 2020 
क्वारेन्टाइनमा बलिउडका कलाकार https://t.co/wBN10rHXuE via @Annapurna_Post, Mar 20 2020 
कोरोना संक्रमण रोक्न काठमाडौँ महानगरले बनायो १० करोडको कोष https://t.co/IQMmpTNVhy via @Annapurna_Post, Mar 19 2020 
कोरोना रोक्‍न मोदीले लगाए ‘जनता कर्फ्यू’ https://t.co/TG6FJaSVCy, Mar 19 2020 
गण्डकी प्रदेश संसद अनिश्चितकालीन स्थगित https://t.co/bWnGu5Mrxy via @Annapurna_Post, Mar 19 2020 
आन्तरिक हवाई भाडा घट्यो https://t.co/ZElms4X2Za via @Annapurna_Post, Mar 19 2020 
कोभिड–१९ विरुद्ध लड्न अमेरिकी सहयोग https://t.co/HHvHF6wU6r via @Annapurna_Post, Mar 19 2020 
कोरोना संक्रमण प्रभाव : सुनसान बन्दै राजधानी (फोटो र भिडियो) https://t.co/OpwRbifWGp via @Annapurna_Post, Mar 19 2020 
इन्डोनेसियामा धार्मिक सम्मेलन रोकेर ९ हजारलाई क्‍वारेन्टाइनमा https://t.co/MGfnl7WSF3, Mar 19 2020 
१०३ वर्षीया महिलाले जब कोरोना भाइरसलाई जितिन् https://t.co/dE6BQBlqY6, Mar 19 2020 
पत्‍नीलाई ढाँटेर प्रेमिका भेट्न जाँदा कोरोना संक्रमित ! https://t.co/sl4vwoqiZm, Mar 19 2020 
बलात्कारको घटना सार्वजनिक गर्छु भनेपछि युवतीको हत्या ! https://t.co/0yCNCnqETK, Mar 19 2020 
कोरोना संक्रमण प्रभाव : प्रदेश १ प्रदेशसभा बैठक स्थगित https://t.co/EZCNT2ERmR via @Annapurna_Post, Mar 19 2020 
गुप्तचरले फोन ट्यापिङ गर्न पाउने https://t.co/aV8uzRms4V via @Annapurna_Post, Mar 19 2020 
कोरोना संक्रमण त्रास : प्रतिनिधिसभाको बैठक चैत १३ गतेसम्मका लागि स्थगित https://t.co/mES5a4qxI1 via @Annapurna_Post, Mar 19 2020 
कोरोनाका संक्रमण त्रास : मनकामना केवलकार पनि बन्द https://t.co/dV8cq5qnvd via @Annapurna_Post, Mar 19 2020 
प्रमुख सचिव हिँडेपछि फेरि अड्कियो भुक्तानी https://t.co/7V6jlNl7Be via @Annapurna_Post, Mar 19 2020 
अज्ञात रोगले दुई बालकको मृत्यु सयौं बिरामी https://t.co/Y8wTNMmYWp via Annapurna Post, Mar 19 2020 
रोकिएन नेपाल-भारत बस सेवा सरकार निर्णयको वेवास्ता https://t.co/9HgT0el6wX via Annapurna Post, Mar 19 2020 
इटालीमा २ हजार भन्‍दा धेरै स्वास्थ्यकर्मी कोरोना संक्रमित https://t.co/MAlDUYxShn, Mar 19 2020 
३ सन्तानकी आमा सेलिब्रिटीको समलिंगी सम्बन्ध खुलेपछि... https://t.co/IoAkiScU7n, Mar 19 2020 
कोरोना त्रास : शुक्रबार सर्वोच्च अदालतमा सुनुवाइ स्थगित https://t.co/7cLZqTTuRk via @Annapurna_Post, Mar 19 2020 
भूमीमन्त्री अर्याल र भारतीय राजदूतबीच भेटवार्ता https://t.co/MH7e0p9qm8 via @Annapurna_Post, Mar 19 2020 
कोरोना त्रास : चिडियाखान पनि बन्द https://t.co/gmLINfwWfz via @Annapurna_Post, Mar 19 2020 
कोरोना संक्रमण रोकथाम : भारतीय नागरिकलाई रोक्ने कैदीको संख्या घटाउने गृहकार्य https://t.co/9v8kJfPi26 via @Annapurna_Post, Mar 19 2020 
कोरोना अपडेट : कहाँ कति संक्रमित कतिको मृत्यु https://t.co/9pvwLi5JsX, Mar 19 2020 
लोकसेवा परीक्षा पनि स्थगित https://t.co/TzVb3cwKEY via Annapurna Post, Mar 19 2020 
भारत तस्करी गर्न लागिएको २० हजार मास्कसहित दुई पक्राउ https://t.co/zK0SC2fj1D via Annapurna Post, Mar 19 2020 
वडा अध्यक्षमाथि नै जातीय विभेद https://t.co/p6i808kRSn via Annapurna Post, Mar 19 2020 
त्रिविका सबै परीक्षा स्थगित प्रशासन खुल्ने https://t.co/s7kluYdh6u via Annapurna Post, Mar 19 2020 
सराङकोटमा प्याराग्लाइडिङको मज्जा https://t.co/tQo4cnp39V via Annapurna Post, Mar 19 2020 
जिल्ला अस्पतालमा आइसोलेसन कक्ष चार ठाउँमा हेल्थ डेक्स https://t.co/G7Wr8KBmCW via Annapurna Post, Mar 19 2020 
घर फर्कन लागेका विद्यार्थीलाई पालिकाको सहयोग https://t.co/0DgfexaK0H via Annapurna Post, Mar 19 2020 
ललितपुरले थाल्यो कोरोनाविरुद्ध तयारी https://t.co/ydBrsPSlHS via @Annapurna_Post, Mar 19 2020 
एसईई स्थगित पछि दुर्गमका विद्यार्थीलाई सास्ती (फोटोफिचर) https://t.co/STGqqdkOUd via Annapurna Post, Mar 19 2020 
हेलिकप्टरबाट ट्रान्सफर्मर ढुवानी https://t.co/THDw4wz6hd via @Annapurna_Post, Mar 19 2020 
कोरोना आशंकामा अस्पताल गएका बिरामीको रिपोर्ट नेगेटिभ https://t.co/H8dObbNZ6G, Mar 19 2020 
कोरोना त्रास : धमाधम छाड्न थाले उपत्यका https://t.co/zjy7Ae48PY, Mar 19 2020 
कोभिड-१९ : नाका आंशिक बन्द https://t.co/A3EIikNzL5 via @Annapurna_Post, Mar 19 2020 
यसरी बिते कुशलको तीन वर्ष : बल्‍ल पाए न्याय https://t.co/GqhCp2SYqe, Mar 19 2020 
सीमामा निगरानी कक्ष https://t.co/z7yfp1XIGX via @Annapurna_Post, Mar 19 2020 
कसरी गर्ने फोन ट्यापिङ ? https://t.co/4kEHrY7426, Mar 19 2020 
इन्जिनियरिङ कलेजको पढाई रोक्ने र परीक्षा स्थगित गर्ने निर्णय https://t.co/CFwoOVjXbA, Mar 19 2020 
चीनबाट फर्किए लीलामणि https://t.co/vHjd8s88c3 via @Annapurna_Post, Mar 19 2020 
आजको कार्टुन @Annapurna_Post https://t.co/961nQ4i4it, Mar 19 2020 
आजको ई-पेपर https://t.co/MnlXfrZLR0 @Annapurna_Post https://t.co/ZqKORCE1qi, Mar 19 2020 
देशको मुहार फेर्ने विकल्प https://t.co/lec2QSahap via @Annapurna_Post, Mar 19 2020 
खुम्चियो आर्थिक गतिविधि https://t.co/uisNj7BxnY, Mar 19 2020 
विश्व बैंक र आईएफसीको १४ अर्ब डलर https://t.co/mJ1BBenYwu, Mar 19 2020 
भरुवा बन्दुकसहित २ जना पक्राउ https://t.co/Virqvx4sS9 via @Annapurna_Post, Mar 19 2020 
भारतमा कोरोनाको आशंका गरिएका बिरामीले अस्पतालमै गरे आत्महत्या https://t.co/EIdz0v8yFz, Mar 19 2020 
स्वावलम्बी अर्थतन्त्रका सपना https://t.co/2Plh2CHqa5 via @Annapurna_Post विकास थापाको लेख, Mar 19 2020 
बाबुराम भट्टराई अस्पताल भर्ना https://t.co/Kq14LZlKCY, Mar 19 2020 
इटलीमा कोरोनाले एकै दिन ४७५ इरानमा १४७ जनाको मृत्यु https://t.co/eFGpuvV323, Mar 19 2020 
बजार संकट https://t.co/eoIroNMlI2 via @Annapurna_Post, Mar 19 2020 
कञ्चनपुर सीमाको नयाँ नक्सा जारी गर्न माग https://t.co/UTi3Nzfj4l via @Annapurna_Post, Mar 19 2020 
विदेशी लगानी प्रतिबद्धता बढ्यो https://t.co/f4iYhlcNCg, Mar 19 2020 
कोरोना त्रास : प्रचण्डले स्थगित गरे भेटघाट कार्यक्रम https://t.co/IhetPqV5iI, Mar 19 2020 
भय बढी चेतना कम https://t.co/sTlXLP9Tbx via @Annapurna_Post, Mar 19 2020 
अन्नपूर्ण पोस्ट्को प्रथम पृष्ठमा अर्थतन्त्र डुब्नबाट जोगाउन युरोपेली मुलुकले उद्योगीलाई बाँड्न थाले ‘ब्ल्याङ्क चेक’ हुनुपर्नेमा अन्यथा भएकोले सच्याइएको छ। - सम्पादक, Mar 19 2020 
फ्रेन्च ओपन पनि सर्‍यो https://t.co/b9dLyCFYfs, Mar 19 2020 
‘ओलम्पिक आयोजना गर्नु संवेदनहीनता’ https://t.co/Pv19ECD9zL, Mar 19 2020 
सभामुख–अध्यक्ष द्वन्द्व : संसदीय काममा असर https://t.co/7RPQsV5P43 via @Annapurna_Post, Mar 19 2020 
मिस नेपाल धरान अडिसनमा ६ जना https://t.co/691QyiWdMq, Mar 19 2020 
पूजाले लिइन् चार गुणा पारिश्रमिक https://t.co/mnrsfGfIVs, Mar 19 2020 
केविनमाथिको भरोसा https://t.co/xj0lBdnrxq, Mar 19 2020 
लिना बनिन् ब्युटिसियन ट्यालेन्ट https://t.co/amYnKt91EH, Mar 19 2020 
सिन्धुलीमा एक वृद्धलाई १०४ डिग्री ज्वरो आइसोलेसनमा भर्ना https://t.co/ZczyyfGV1V via Annapurna Post, Mar 19 2020 
जरुरीबाहेक हिँडडुलमा रोक https://t.co/MlB44l1rXq via @Annapurna_Post, Mar 19 2020 
‘विदेशमा कोरोना भाइरसबाट सतर्क रहनू’ https://t.co/toTfIVLqlI via @Annapurna_Post, Mar 19 2020 
एसईईको महत्ता https://t.co/RN4cdGqIot via @Annapurna_Post डा. नम्रता पाण्डेको विचार, Mar 19 2020 
संक्रमित देशबाट नेपाल आउन प्रतिबन्ध https://t.co/FsrKqdoUPD via @Annapurna_Post, Mar 19 2020 
कोरोनाले ८ हजार बढीको मृत्यु https://t.co/Hq3AomfbyK, Mar 18 2020 
कास्की अदालतका स्रेस्तेदार घुससहित पक्राउ https://t.co/34DvXvPNAR via @Annapurna_Post, Mar 18 2020 
नेपाल-भारत चल्ने बस रोक लगाउने निर्णय कार्यान्वयनमा आलटाल https://t.co/NOgcP63LWc, Mar 18 2020 
कोरोना रोक्‍न 'लक डाउन' को रिहर्सल : कहाँ-कहाँ बन्द र प्रतिबन्ध ? https://t.co/CbILB9z3qH via @Annapurna_Post, Mar 18 2020 
त्रिविको बिहीबारको परीक्षा हुन्छ : उपकुलपति https://t.co/PfPwAa9aGk via @Annapurna_Post, Mar 18 2020 
संक्रमणको डर : मास्क लगाएरै बस्यो नेकपा सचिवालय बैठक https://t.co/iX24lciWhN, Mar 18 2020 
एसईई स्थगित https://t.co/Ky097pK0lS via @Annapurna_Post, Mar 18 2020 
परीक्षामा चिट समातिएपछि छात्राले गरिन् आत्महत्या https://t.co/cy5w5NRjxA, Mar 18 2020 
गण्डकीका मुख्यमन्त्रीको सम्पति : सुन ५१ तोला चाँदी ९० तोला https://t.co/eklZj2R6uu, Mar 18 2020 
प्रशासकीय अधिकृतविरुद्ध भ्रष्टाचार मुद्दा https://t.co/zkz9Vu8IEA, Mar 18 2020 
रजिष्ट्रेसन फारम नभरेका विद्यार्थीलाई प्रवेशपत्र उपलब्ध गराइदिने भन्दै घुस https://t.co/0U4yWEpQBT, Mar 18 2020 
डोजरमा आगजनी https://t.co/Cm6vSVnuzo, Mar 18 2020 
नेप्से निरन्तर ओरालो https://t.co/p0ct5vsN5K, Mar 18 2020 
त्रिविको परीक्षा यथावत रहने https://t.co/SW7Wa4iQ5k, Mar 18 2020 
बेसहारा वृद्धा दम्पतीको बन्‍ने भयो घर https://t.co/L4Q8TBUHZP, Mar 18 2020 
कोरोना त्रास : शुक्रबारदेखि नेपाल आगमनमा प्रतिबन्ध https://t.co/vpeTulefp4 via @Annapurna_Post, Mar 18 2020 
अब २५ जनाभन्दा बढी भेला हुन नपाइने https://t.co/ryrcwNQQGU, Mar 18 2020 
कोरोनाले अमेरिकामा मृत्यु हुनेको संख्या १ सय नाघ्यो https://t.co/nQhEasxJQq, Mar 18 2020 
कोरोना रोक्ने सरकारका १५ कदम : विद्यालय र कलेज चैत मसान्तसम्म बन्द https://t.co/RcD9NDmh7n via @Annapurna_Post, Mar 18 2020 
जंगीअड्डामा कोरोना भाइरस नियन्त्रणबारे पूर्वाभ्यास (फोटो/भिडियो) https://t.co/iYLsBfJQ78, Mar 18 2020 
घनश्यामको कृषि क्रान्तिका पाँच सूत्र https://t.co/yCIWbGYGIi via @Annapurna_Post, Mar 18 2020 
कोरोना संक्रमण रोकथाम उच्चस्तरीय समिति बैठक सिंहदरबारमा https://t.co/hyEopSOmMo via @Annapurna_Post, Mar 18 2020 
क्‍वारेन्टाइनबाट फर्काइएको कुकुरको मृत्यु https://t.co/bQBLEiW7KL via @Annapurna_Post, Mar 18 2020 
नेपालमा कोरोना फैलिए के हुन्छ ? https://t.co/BuN7a5Fiqb via @Annapurna_Post, Mar 18 2020 
कोरोना प्रभावित देशमा के छ नेपालीको खबर ? https://t.co/dfbwdq8HFl via @Annapurna_Post, Mar 18 2020 
फेरि १० लाख मास्कसहित एक पक्राउ https://t.co/d7Vx0z9zvg, Mar 18 2020 
कुन ब्लड ग्रुपलाई कोरोनाको बढी खतरा ? https://t.co/1TpZLjpliX via @Annapurna_Post, Mar 18 2020 
भारतीय रुपैयाँसहित पक्राउ https://t.co/R5RgKro02H via Annapurna Post, Mar 18 2020 
नेपाल र इङ्ग्ल्याण्डबीचको खेल स्थगित https://t.co/zEfwUZLDuf, Mar 18 2020 
नेपालगन्ज नाका आंशिक बन्द (फोटो फिचर) https://t.co/Dm74rypHED via @Annapurna_Post, Mar 18 2020 
दादुरा-रुवेला खोप अभियानबारे सचेत गराइँदै https://t.co/Zj4eE3VD7s via Annapurna Post, Mar 18 2020 
कोरोना भाइरसबारे गाउँपालिकाको सचेतना https://t.co/ivsUSrwNTp via Annapurna Post, Mar 18 2020 
अमेरिकाको ५० वटै राज्यमा कोरोना संक्रमण https://t.co/KMCptAtFgl via @Annapurna_Post, Mar 18 2020 
यस्तो बन्दै छ गुराँसेमा भ्यू टावर https://t.co/n468eOvJIu via Annapurna Post, Mar 18 2020 
सुनसान बन्दीपुर https://t.co/zK8vVny40m via Annapurna Post, Mar 18 2020 
गुप्तेश्वर बहुमुखी क्याम्पसमा ताला https://t.co/814y7O6oIm via @Annapurna_Post, Mar 18 2020 
पूर्वप्रधानन्यायाधीश श्रेष्ठको निधन https://t.co/uTJCyToPCd via @Annapurna_Post, Mar 18 2020 
अपव्यय नमुना ! https://t.co/YEZs4cDLn9 via @Annapurna_Post कृष्णप्रसाद सिग्द्यालको विचार, Mar 18 2020 
भैरहवा नाकाबाट इन्धन निरन्तर आयात https://t.co/Iqkis1owUK via Annapurna Post, Mar 18 2020 
कोरोना प्रभाव : तातोपानी कुण्ड बन्द https://t.co/Hih3p5uQ3H via Annapurna Post, Mar 18 2020 
भक्तपुरबाट ५७३६ जनाले एसईई दिँदै प्रत्येक परीक्षा केन्द्रमा हेल्थ डेक्स र आइसोलेन कक्ष https://t.co/ADXdAuuM2G via Annapurna Post, Mar 18 2020 
बलात्कार आरोपी दुई महिनापछि पक्राउ https://t.co/xOVvzc3x8L via Annapurna Post, Mar 18 2020 
अपव्यय नमुना ! https://t.co/YEZs4cmavB via @Annapurna_Post, Mar 18 2020 
चीनले तीन अमेरिकी सञ्चार संस्थाका पत्रकार निष्कासन गर्दै https://t.co/VN0foZ8Nav via @Annapurna_Post, Mar 18 2020 
भिडियो सम्मेलन र मानवीय सुरक्षा https://t.co/0l6P9vhcLm via @Annapurna_Post author-image डा. पूर्ण सिलवालको विचार, Mar 18 2020 
भाजपाको नीति र हाम्रो चुनौती https://t.co/OFxnneCONb via @Annapurna_Post, Mar 18 2020 
जोरपाटी-सुन्दरीजल सडक : ठेक्काको ४ वर्षपछि निर्माण सुरु https://t.co/JswKmMwjd7, Mar 18 2020 
प्राधिकरणको राजस्व आधा घट्यो https://t.co/R00tRphH6G, Mar 18 2020 
संकटमा बैंकले पनि साथ दिनुपर्छ https://t.co/gCqlVnZajJ, Mar 18 2020 
प्रधानमन्त्रीलाई कालोबजारियाको पत्र https://t.co/bVjWyyDMIG via @Annapurna_Post अखण्ड भण्डारीको भ्वाइस अफ दि भ्वाइसलेस, Mar 18 2020 
गभर्नर नेपाल अपेक्षाभन्दा अब्बल https://t.co/NmCzEhBT7D, Mar 18 2020 
भद्रगोल प्रधानमन्त्री कृषि परियोजना https://t.co/3IhCG0J9U7 via Annapurna Post सम्पादकीय, Mar 18 2020 
प्रदेश ५ मा १२ सय क्षमताको क्वारेन्टाइन https://t.co/0D21RiBULI via @Annapurna_Post, Mar 18 2020 
प्रदेश २ को नामबारे बाबुरामको हिन्दी ट्विट ‘कुछ तो शरम करो यारो’ https://t.co/Qt7hhVDsfe, Mar 18 2020 
डारफोरमा सैन्य मिसन अन्त्यको तयारी https://t.co/CzJByBfFIh, Mar 18 2020 
तेलको जर्किनमा लागुऔषध https://t.co/o5AetcBZ91 via @Annapurna_Post, Mar 18 2020 
८० रुपैयाँ तिर्न हजार खर्च https://t.co/Atvyvr9wlA via @Annapurna_Post, Mar 18 2020 
हाइड्रो हब बन्दै लिखु करिडोर https://t.co/zPVOj1dCFv via @Annapurna_Post, Mar 18 2020 
कोरोना संक्रमणबाट फुटबल प्रशिक्षकको निधन https://t.co/pBMkFmt4sy, Mar 18 2020 
हल्लाले सीमावासी हैरान https://t.co/7VhfwcbsA4 via @Annapurna_Post, Mar 18 2020 
युरो कप एक वर्ष सर्‍यो https://t.co/ohD0YBVyE6, Mar 18 2020 
आजको कार्टुन @Annapurna_Post https://t.co/lLtMTDSYOL, Mar 18 2020 
एसईई बेस्ट मोडल छनोट सुरु https://t.co/HLrfpD6MQJ, Mar 18 2020 
