Tweet,Date
कटारी आईसोलेसनमा बसेका मग्राती फरार https://t.co/963tVTCSWp,Mar 28 2020 
कोरोना कहर रोक्न गाउँ–गाउँमा प्रहरी https://t.co/9jeWwKJ3wM,Mar 28 2020 
क्षेत्रीय आइसोलेसन स्थापना गर्न स्थानीय तहको पाँच/पाँच लाख https://t.co/fDVJzNdsMn,Mar 28 2020 
पीपिई मौज्दात रित्तिदै तनावमा स्वास्थ्यकर्मी https://t.co/TQyxrrmNGX,Mar 28 2020 
लकडाउन उल्लंघन गर्ने चर्चका दुई पाष्टर पक्राउ https://t.co/khgQL8kEzs,Mar 28 2020 
जनकपुरमा रगतको अभाव https://t.co/yc9qPqltSz,Mar 28 2020 
फिदिम नरपालीकाले बनायो द्रुत कार्यटोली https://t.co/rDDZj6H9dU,Mar 28 2020 
रौतहटमा ६० जनालाई क्वारेन्टाइनमा राखियो https://t.co/H3YauTNi3k,Mar 28 2020 
गोरखा नगरपालिकाले मुख्य बजार क्षेत्रमा क्लोरिन झोल छर्कियो https://t.co/HDucO59DsN,Mar 28 2020 
स्वदेश फर्किन चाहेनन् पर्यटक https://t.co/24EPKq36dN,Mar 28 2020 
आइसोलेसनमा उपचाररत तीन जनाको स्वाब संकलन https://t.co/w0ErOxgE5V,Mar 28 2020 
दाङमा दुई जनाको कोरोना रिपोर्ट नेगेटिभ https://t.co/vY1z6LWPtd,Mar 28 2020 
कोरोनाबारे जानकारी लिन १११५ र ११३३ का कल गर्नुस् https://t.co/vYH77YrzTE,Mar 28 2020 
पानीको महसुल छुट https://t.co/tihxJiyELj,Mar 28 2020 
जसले पुर्‍याइदिए विपन्नका घरघरमै चामलका बोरा https://t.co/XiqNCRcGPN,Mar 28 2020 
दोस्रो र पाँचौ संक्रमित किशोरी एउटै विमानमा थिए https://t.co/7c0ssSYI0J,Mar 28 2020 
नेपालमा कोराेनाको पाचौं संक्रमित फेला https://t.co/c8rFwycdEz,Mar 28 2020 
लकडाउन प्रभावित विपन्नलाई दाल चमल सहयोग https://t.co/UD922mGXhr,Mar 28 2020 
संक्रमण नफैलियोस भन्दै भगवती मन्दिरमा पूजा र बलि https://t.co/IMKY7LkqO2,Mar 28 2020 
ताप्लेजुङबाट ३ पर्यटकको उद्वार https://t.co/yzCPEpRM25,Mar 28 2020 
घरधनीसँग आधा महिनाको पैसा छुट दिन आग्रह https://t.co/kPdSIsE6N6,Mar 28 2020 
उच्च मनोबलले मात्रै कोरोनाविरुद्धको लडाईं जित्छौँ : अध्यक्ष दाहाल https://t.co/2JgY25xYHx,Mar 28 2020 
कोरियामा रहेका नेपालीले सरकारलाई १ करोड १५ लाख रुपैयाँ सहयोग गर्ने https://t.co/7Q7564AAXO,Mar 28 2020 
जिल्ला विपद् व्यवस्थापन समितिलाई सामग्री प्रदान https://t.co/2jDvpeDfZE,Mar 28 2020 
म्याग्दीमा कीटनाशक औषधि छर्न सुरु https://t.co/SSgFdJolYW,Mar 28 2020 
राष्ट्रसंघका ८६ कर्मचारी लाई कोरोना भाईरसको सङ्क्रमण https://t.co/ta0aIG4lGa,Mar 28 2020 
तनहुँमा विदेशबाट फर्किएका ४ सय १० जना https://t.co/ZnwUezS4aa,Mar 28 2020 
राष्ट्रसंघका ८६ कर्मचारीलाई कोरोना भाईरसको सङ्क्रमण https://t.co/ZQmfFyYszS,Mar 28 2020 
संक्रमित देशबाट फर्कनेलाई खोज्दै जनप्रतिनिधि https://t.co/NXhVh9yD4w,Mar 28 2020 
मनास्लु घुम्न गएका ३२ जना पर्यटकको उद्वार https://t.co/Y0JnQYMcNP,Mar 28 2020 
कोभिड –१९ :  बीस परीक्षण नेगेटिभ https://t.co/2uIgD09liN,Mar 28 2020 
कोरोना परीक्षण प्रयोगशाला स्थापना गर्न अन्यौल https://t.co/h8H3H34xkp,Mar 28 2020 
स्वास्थ्य सामाग्री लिन चीन उड्यो नेपाल एयरलाईन्सको जहाज https://t.co/t0kEga0yTU,Mar 28 2020 
सनराइज बैकद्वारा अस्पताललाई पीपीई हस्तान्तरण https://t.co/PK89WqD8RG,Mar 28 2020 
कोभिड –१९ :  बीस परीक्षण नेगेटिभ https://t.co/VaAaNHhPus,Mar 28 2020 
लकडाउन प्रभाव : ताप्लेजुङका तरकारी हाट पनि ठप्प https://t.co/6s89kCqEjK,Mar 28 2020 
पहिलो दिन १०५ जनालाई राखियो https://t.co/UfFHd0pBLj,Mar 28 2020 
दुई महिनाको घरभाडा छुट https://t.co/O6L7akiKl7,Mar 28 2020 
‘पाङग्राले रनवेमा नटेक्दै विमान झाडीमा पुग्यो’ https://t.co/au0G0R7Mhn,Mar 28 2020 
न्युयोर्कबाट आएकालाई यात्रामा प्रतिवन्ध https://t.co/O84vPRm5d5,Mar 28 2020 
ऐतिहासिक गढीमा राखिएको ढुंगाको तरबार तोडफोड https://t.co/GcVpBRxs1f,Mar 28 2020 
कोभिड–१९ बाट इटालीमा एकैदिन ९१९ को मृत्यु अमेरिकामा सङ्क्रमित १ लाख नाघ्यो https://t.co/BV14JpZR4T,Mar 28 2020 
रौतहटमा लकडाउनकै अवधिमा एक किशोरी बलात्कृत https://t.co/DMQdNEes9o,Mar 28 2020 
कोरोना भाइरसपछिको विश्व ? https://t.co/kf2mrCCOgK,Mar 28 2020 
यसरी बनाउँदैछ आविस्कार केन्द्रले पीपीई (तस्बिर) https://t.co/A4tBcDwEEv,Mar 28 2020 
तरकारी कुहियो ग्राहक महँगोमा किन्न बाध्य https://t.co/8WQEKzydgs,Mar 28 2020 
तरकारी कुहियो ग्राहक महँगोमा किन्न बाध्य https://t.co/eutzLXZiZh,Mar 28 2020 
कोरोनाबारे जानकारी दिन सरकारले अनलाइन ल्याउँदै https://t.co/Inu154TVL9,Mar 28 2020 
रसुवागढी नाका खोल्ने बारे अन्योल https://t.co/rTMwDs6c5n,Mar 28 2020 
कोरोनाविरुद्ध सामाजिक सञ्जालमा सन्देश https://t.co/PSMqVJ6BuL,Mar 28 2020 
बैतडीमा चितुवाको आक्रमणबाट महिला घाइते https://t.co/rnSDotYKV3,Mar 28 2020 
वडाध्यक्षद्वारा खाद्यान्न सहयोग https://t.co/1W6IkAwE41,Mar 28 2020 
प्रयोगशाला परीक्षण सुस्त परदेशबाट आउनेहरु निर्धक्क गाउँ डुल्दै https://t.co/J8MU4nIKy5,Mar 28 2020 
लकडाउन प्रभाव बारीमा तरकारी सड्दै बजारमा महँगो https://t.co/FfBk4krfXD,Mar 28 2020 
अन्धविश्वास कोरोना भ्रम : दलाई लामाको सन्देशको हल्ला चलेपछि आँगन खन्दै अँगार खोज्दै https://t.co/7v3HBXEtLi,Mar 28 2020 
आजदेखि प्रहरीको कडाइ बिहानै २००  नियन्त्रणमा https://t.co/fuhsUU0tin,Mar 28 2020 
दैनिक तीन घण्टा तरकारी हटिया सञ्चालन https://t.co/QNJKEfvXpy,Mar 28 2020 
कैदीबन्दी नै तयार छैनन् कारागार छाेड्न https://t.co/FURSA9Cqqs,Mar 28 2020 
कर्मचारीले अनिवार्य जम्मा गर्नुपर्ने https://t.co/FwCzFYLaKD,Mar 28 2020 
भ्रम फैलाउने पक्राउ https://t.co/u3X88YUtFl,Mar 28 2020 
लकडाउन प्रभाव : कहाँ कति प्रदुषणको मात्रा देखियो ? https://t.co/6xXVQDjmWS,Mar 28 2020 
यति बेला लकडाउन छ। अति आवश्यक सामान किन्न पसल जाँदै हुनुहुन्छ ? https://t.co/f2XDuA1O9s,Mar 28 2020 
सकारात्मक सोच्ने हँसाउने चलचित्र हेर्ने आफन्तसँग टेलिफोनमा कुराकानी गर्ने स्वस्थकर खाना खाने धेरै नखाने चिल्लो बढी नखाने घरभित्र व्यायाम योग भ-याङमा हिँडडुल गरेर सम्भावित स्वास्थ्य जोखिमबाट बच्न चिकित्सहरुले सुझाएका छन्। https://t.co/GtmoDHRy2A,Mar 28 2020 
दायरा बढाउँदा शंका लागेका बिरामीमात्र होइन इच्छुक अन्यले पनि परीक्षण गराउन पाउँछन्। https://t.co/zt1TdUbYzq,Mar 28 2020 
लकडाउनमा तरकारी बजार (फोटो फिचर) https://t.co/NlVdhQRGfI,Mar 27 2020 
पर्यटकको उद्धार मजदुर बिचल्लीमा https://t.co/ncfHtzOb5O,Mar 27 2020 
धनगढीमा भेटिए कोरोना संक्रमणका चौथो विरामी https://t.co/tCt2PAB3vN,Mar 27 2020 
धनगढीमा कोरोना संक्रमणका विरामी भेटिएका छन्। स्वास्थ्य मन्त्रालयका प्रवक्ता विकास देवकोटाका अनुसार उनको सेति अस्पतालमा उपचार भइरहेको छ। यो नेपालमा भेटिएको चौथो केस हो। #coronavirus,Mar 27 2020 
स्वास्थ्य मन्त्रालयको पत्रकार सम्मेलन सरकार भन्छ : कोरोना संक्रमण फैलावटको अवस्था नियन्त्रणमै छ https://t.co/SRGXBAWB0Q,Mar 27 2020 
गाउँमा झन् त्रास विदेशबाट फर्केका क्वारेन्टाइनमा बसेनन् https://t.co/1t2Ui9GUiD,Mar 27 2020 
लकडाउनको चौंथो दिन भक्तपुरको अवस्था (फोटोफिचर) https://t.co/aepGEairHd,Mar 27 2020 
विद्युतका ३८ लाख ग्राहकलाई महसुलमा २० प्रतिशत छुट https://t.co/IS4A6Bm4sl,Mar 27 2020 
कोभिड–१९ : सचेतनामा अहोरात्र खट्दै जनप्रतिनिधि https://t.co/CbyrZP3BQZ,Mar 27 2020 
बेलायती प्रधानमन्त्री बोरिस जोन्सनलाई कोरोना संक्रमण https://t.co/kK74t324c9,Mar 27 2020 
नुवाकोटका डोटेलको युएईमा शंकास्पद मृत्यु https://t.co/Ne9BzQ0zo1,Mar 27 2020 
रसुवामा एक घर एक साबुन वितरण https://t.co/bkmOZbkkfD,Mar 27 2020 
ताप्लेजुङमा १ सय ५ शैयाको क्वारेन्टाइन र १४ शैयाको आइसोलेन कक्ष https://t.co/tjWYeZMdH2,Mar 27 2020 
राहत प्याकेज घोषणा गर्न कांग्रेसको आग्रह https://t.co/APG9Dtx1JV,Mar 27 2020 
कोरोना कोषमा धादिङका सांसदहरुको एक महिनाको तलब https://t.co/ZAanmdedpp,Mar 27 2020 
फुर्सदमा हेर्नुस् १० नेपाली सिनेमा https://t.co/ojY9b6A9Ne,Mar 27 2020 
फुङ्लिङमा दैनिक उपभोग्य बस्तुको माैज्दात सूची तयार https://t.co/ruoW1f8zsz,Mar 27 2020 
कोरोना विरुद्ध सँगै लड्न अमेरिकी राष्ट्रतिलाई चिनियाँ राष्ट्रपतिको आग्रह https://t.co/Ay8YGtCTjD,Mar 27 2020 
स्वास्थ्यकर्मीका लागि पचास लाखको बीमा गरिदिन माग https://t.co/RH62M6RVFm,Mar 27 2020 
दुई देशको ‘लकडाउन’ले छेकेन लागुऔषध सेवनकर्तालाई https://t.co/OOYiAVX1Xj,Mar 27 2020 
अब आधा भरेको ग्यास सिलिन्डर बजारमा https://t.co/M5M9Gy0cJX,Mar 27 2020 
अर्घाखाँचीमा १६ जना क्वारेन्टाइनमा https://t.co/zDx1Dz0FqT,Mar 27 2020 
आकस्मिक कोषमा कर्मचारीले दिए तीन दिनको तलब https://t.co/vzY5lYhVDJ,Mar 27 2020 
कोरोना रोकथामका लागि गाउँपालिकामा बजेट रकमान्तर https://t.co/L0OPSLFs8t,Mar 27 2020 
कपिलवस्तुमा १३ वर्षिया बालिका छिमेकी युवाबाटै बलात्कृत https://t.co/vw8bDsZjjN,Mar 27 2020 
चीनले अनुदानमा दिएको मेडिक किट भोली आइपुग्ने https://t.co/ErbkPVke1x,Mar 27 2020 
कोरोना कहर : गाउँगाउँमा गाउँले नियम ! https://t.co/jhh2xCjr35,Mar 27 2020 
पाँचथरमा दुई जनालाई आइसोलेसनमा राखियाे https://t.co/qkD9xOW2VP,Mar 27 2020 
डोल्पाका स्वास्थ्यकर्मीले बनाए पीपीई https://t.co/tL6YXwzKwX,Mar 27 2020 
पोखरीमा डुबेर दाजुभाईको मृत्यु https://t.co/XQMkVGHpGJ,Mar 27 2020 
घरबाहिर निस्कन निषेध गर्न कांग्रेसको आग्रह https://t.co/Lz4GTvmZBt,Mar 27 2020 
‘लकडाउन’को मर्मलाई पालना गर्न युवा संघको आग्रह https://t.co/meAUx8r1QE,Mar 27 2020 
अवस्था बुझ्न राज्यमन्त्री मानन्धर सडकमा https://t.co/YmOfQqpHnt,Mar 27 2020 
नदीमा बगेर एक युवक बेपत्ता https://t.co/iUWhXaaIwt,Mar 27 2020 
तेत्तीस लाख अमेरिकीद्वारा बेरोजगारी भत्ताको दाबी https://t.co/EvOvsvOPkp,Mar 27 2020 
लुकीछिपी प्रवेश गर्नेहरु धमाधम पक्राउ पर्दै https://t.co/wvkmcgfzRA,Mar 27 2020 
१७ शैयाको आइसोलेसन सञ्चालनमा स्वास्थ्यकर्मी र सामग्री अभाव https://t.co/1L5dOJQSJU,Mar 27 2020 
विदेशबाट फर्केकालाई इमान्दारीसाथ क्वारेन्टाइनमा बस्न आग्रह https://t.co/2CRw8sNU0u,Mar 27 2020 
पारदर्शिता पहिलो सर्त https://t.co/3pnaB6OtYB,Mar 27 2020 
लक डाउन : चीनको अनुभव https://t.co/PjbVf8DCaR,Mar 27 2020 
इटलीमा कसरी भइरहेको छ अन्तिम संस्कार ? https://t.co/3l25SnEFIs,Mar 27 2020 
जर्मनले आफ्ना नागरिक लैजान जहाज पठायो https://t.co/HD6OOPC99f,Mar 27 2020 
रसुवामा २ सय ११ शैयाको क्वारेन्टाइन र ५५ शैयाको ‘आसोलेसन’ सञ्चालन https://t.co/ODPAYrbogM,Mar 27 2020 
बस दुर्घटनामा सहचालकको मृत्यु https://t.co/xGox1RftZZ,Mar 27 2020 
ईट्टाभट्टाबाट फर्केका एक जनालाई आईसोलेसनमा राखियो https://t.co/Avv0lq6CEG,Mar 27 2020 
नुवाकोटमा खाद्यान्न पर्याप्त https://t.co/z7ArQBZfed,Mar 27 2020 
काँग्रेस महासमिति सदस्य लामाको निधन https://t.co/rlt8O8FjSV,Mar 27 2020 
प्रधानमन्त्री ओली अस्पताल भर्ना https://t.co/VuuQzR792a,Mar 27 2020 
प्रदेश १ : कोरोना त्रास नमुना परीक्षण सुस्त https://t.co/PTRFpYfgrO,Mar 27 2020 
साकिराको कम्पनीले स्यानिटाइजर बनाउँदै https://t.co/jrJGfu9sUl,Mar 27 2020 
बेलैमा नमुना परीक्षण नहुँदा बिरामीको रोग पहिचान र थप उपचारमा बाधा पुगेको छ। https://t.co/nS97FRVvYI,Mar 27 2020 
कोरोना त्रास चिकित्सकलाई पिपिई अभाव https://t.co/52BRQRtju9,Mar 27 2020 
ढिलो रिपोर्टले उपचारमै असर https://t.co/uOzP8MMa2Y,Mar 27 2020 
चीनबाट स्वास्थ्य सामग्री आइतबारसम्म आइपुग्ने https://t.co/6ZM5Vdjjbn,Mar 27 2020 
दैनिक उपभोग्य सामान किन्न यस्तो लक्ष्मण रेखा (फोटो फिचर) https://t.co/PWmBOcUKPa,Mar 26 2020 
सात सय भन्दा बढीको कोरोना परीक्षण https://t.co/ZhGfh8FKr3,Mar 26 2020 
आपतकालिन रणनीति बनाउन सुझाव https://t.co/Xm25BLVazv,Mar 26 2020 
सरकार कोरोना भाईरसबाट संक्रमितको उपचार आपूर्ति र शान्ति सुरक्षामा केन्द्रीत : मन्त्री पोखरेल https://t.co/5HWSD7qER9,Mar 26 2020 
ज्यालादारी गर्नेहरुलाई दश किलो चामल र दुई किलो दाल घरमै पुर्‍याइने https://t.co/21H8xqyFbt,Mar 26 2020 
लुक्लाबाट पर्यटक काठमाडौं ल्याइयो https://t.co/h3eqQOxh8F,Mar 26 2020 
रोकिएका पर्यटकको मुस्ताङ र पोखराबाट उद्धार https://t.co/ht1eFkHheI,Mar 26 2020 
विदेशबाट आएकालाई अनुहार हेरेर औषधि https://t.co/6iZPAAnu11,Mar 26 2020 
स्वास्थ्यकर्मीले माइकिङ गर्छन्  वडाध्यक्षले मोटरसाइकल चलाउछन् https://t.co/HxwzkiS7TC,Mar 26 2020 
स्वास्थ्यकर्मीले माइकिङ गर्छन्  वडाध्यक्षले मोटरसाइकल चलाउछन् https://t.co/wvXMUdNUvf,Mar 26 2020 
लुक्लाबाट पर्यटक काठमाडौं ल्याइयो https://t.co/Xu7yM1VcMj,Mar 26 2020 
११ वर्षिय बालक आइसोलेसनमा https://t.co/JAlF0k4hJZ,Mar 26 2020 
भारतबाट जुम्ला भित्रिएका ३१ जना क्वारेन्टाइनमा https://t.co/CtJa3mR5zt,Mar 26 2020 
पीपीईबिनै स्वास्थ्य जाँचमा स्वास्थ्यकर्मी https://t.co/s4Dp0jgGV1,Mar 26 2020 
रामेछापको स्थानीय तहमा आइसोलेसन कक्ष तयार हुँदै https://t.co/hBlisubP3c,Mar 26 2020 
सरकारले लकडाउनका बेला खाना पकाउने एलपी ग्यासको सम्भावित अभावलाई मध्यनजर गर्दै विद्युतीय चुल्हो (इन्डक्सन) बाट खाना पकाउँदा विद्युत महसुलमा छुट दिने भएको छ। https://t.co/Ul7nsR0D4K,Mar 26 2020 
तेह्रथुममा २९ जना होम क्वारेन्टाइनमा https://t.co/sCHAex52IO,Mar 26 2020 
घरमै पुगेर मास्क र साबुन वितरण गर्दै युवा https://t.co/9W35YJVGUS,Mar 26 2020 
कतार एयरबाट आएका २ जना सम्पर्कमा एक जनाको खोजी https://t.co/OOm2mHndpm,Mar 26 2020 
१४ दिन क्वारेन्टाइन राखिने https://t.co/NaVRaS8uP5,Mar 26 2020 
व्यक्तिगत पहलमा सुरक्षा सामग्री बनाएर स्थानीय सरकारलाई हस्तान्तरण https://t.co/Vpb3N0gsw9,Mar 26 2020 
सिन्धुलीको दुधौलीमा हात्तिको आक्रमणबाट दुई घाइते https://t.co/JOCYGfBFX7,Mar 26 2020 
भारतबाट आएकालाई क्वारेन्टाइनमा राख्दा स्वास्थ्यकर्मी कुटिए https://t.co/TyjQpkc2Yz,Mar 26 2020 
दैलेखमा १० जनामा ज्वरो देखियाे https://t.co/zu39AIPGKs,Mar 26 2020 
मनकारी व्यावसायी : रोकिएका विदेशीलाई निःशूल्क खाना https://t.co/jvDEK1XZPJ,Mar 26 2020 
माछा मार्ने क्रममा करेन्ट लागेर युवकको मृत्यु https://t.co/3vQvbVveUt,Mar 26 2020 
विदेशबाट फर्किएका युवा खोज्दै नगरपालिका https://t.co/ekiSSz3aKd,Mar 26 2020 
रौतहटमा करिब पाँच सय बेड तयारीको अवस्थामा https://t.co/5QJOvyfLb4,Mar 26 2020 
उदयपुरका बेलकामा २० र चौदण्डीगढीमा २९ बेडका क्वारेन्टाइन https://t.co/abM9iBVmsf,Mar 26 2020 
प्रदेश २ सरकारद्वारा २५ करोड कोष र तीन वटा ल्याव स्थापना गर्ने निर्णय https://t.co/3jJiItLR9E,Mar 26 2020 
संक्रमित किशोरीसँगै आएका रुपन्देहीका ३ जनालाई क्वारेन्टाइनमा राख्न बेवास्ता https://t.co/0T1hMNgXjE,Mar 26 2020 
अन्यत्रबाट जाजरकोट आएका ४९ जना सैनिक ब्यारेकभित्रको क्वारेन्टाइनमा https://t.co/VCI1HKzjSf,Mar 26 2020 
मुस्ताङमा रहेका पर्यटकलाई पोखरा ल्याइदै https://t.co/GM2UCX8V30,Mar 26 2020 
संकटको समय मानवीय धर्म https://t.co/LhdCwAyKPK,Mar 26 2020 
संक्रमित युवतीसँगै आएका ताप्लेजुङका चार जना क्वारेन्टाइनमा https://t.co/kRYstxXNAD,Mar 26 2020 
ताप्लेजुङमा पत्रपत्रिकाको प्रकाशन बन्द https://t.co/PM79dyu2r6,Mar 26 2020 
भारतबाट आएका थप ६ जनालाई कटारी क्वारेन्टाईनमा राखियो https://t.co/nHl76kONAD,Mar 26 2020 
लकडाउनको अवधिमा अपराधिक घटना हुनेतर्फ सचेत रहन आग्रह https://t.co/PJtQc9lXFE,Mar 26 2020 
