Tweet,Date
किसानलाई हाते ट्याक्टर https://t.co/b6hIbj9y6J,Feb 23 2020 
पर्साको महुवनमा कृषि मेला https://t.co/IHARe9TVH5,Feb 23 2020 
नेपालतर्फ लोड फ्लो टेस्ट सकियो https://t.co/HRn4KxCp8w,Feb 23 2020 
भन्सार राजस्व लक्ष्यभन्दा ३२ प्रतिशत कम https://t.co/5VpYaxNGwN,Feb 23 2020 
निर्दोष कैदीबन्दी ! https://t.co/JP8U5CRnL8,Feb 23 2020 
देखिएकै हो दार्चुला ? https://t.co/UrxOXuuBEx,Feb 23 2020 
जसले कोरोना संक्रमण जिते https://t.co/YU949rqFH8,Feb 23 2020 
दलदलमा मधेसी दलित महिला https://t.co/gFCrEFHtqr,Feb 23 2020 
हटाऊ शिक्षामा लैंगिक विभेद https://t.co/mUbGmzkBOs,Feb 23 2020 
सिलिगुढी पुगेर पाहुना बोलाउँदै पोखरा https://t.co/AOL6aNIPS8,Feb 23 2020 
भारतको पहिलो औपचारिक भ्रमण गर्दै ट्रम्प https://t.co/mReSQ5zXgh,Feb 23 2020 
‘प्यारासाइट’ लाई अस्कर दिएकोमा ट्रम्पको आपत्ति https://t.co/5cpgUo9MGh,Feb 23 2020 
प्रदर्शनीमा जीवनको उतारचढाव https://t.co/7OmaSDF60v,Feb 23 2020 
बजारमा ‘कुमारी प्रश्नहरू’ https://t.co/1vjUY1xUeB,Feb 23 2020 
समलिंगीप्रतिको डर हटाउँदै ‘शुभ मंगल ज्यादा सावधान’ https://t.co/yWGuwMbzi3,Feb 23 2020 
अफ्रिकामा प्रतिरोधको तयारी छैन : डब्लुएचओ https://t.co/K1h5d5kSGs,Feb 23 2020 
ककनी डाँडालाई ढुंगे बगैंचा बनाउने तयारी https://t.co/f1yYAebm71,Feb 23 2020 
बाह्रवनमा अनियमितता विषयगत समिति र मन्त्रालयको कुरो बाझियो https://t.co/qJUjZ3OXyY,Feb 23 2020 
रावाबेंसीमा विद्यार्थीलाई दिवा खाजा https://t.co/QmZnTkg2Xb,Feb 23 2020 
चिनियाँ पाइलट सहभागी नहुने https://t.co/nyYjrs5c2M,Feb 23 2020 
३९ हजार शिक्षक दरबन्दी अभाव https://t.co/UtCuHQ5ZU0,Feb 23 2020 
फाइनलमा लिगको झझल्को https://t.co/Ru5Ib3u6q2,Feb 23 2020 
पुनरागमनमा एपिएफलाई सफलता https://t.co/iD6qW7kpsE,Feb 23 2020 
‘बी’ डिभिजन विजेतालाई १५ लाख https://t.co/k1TODOjUj8,Feb 23 2020 
सरकारी जग्गामा निजीको हालीमुहाली https://t.co/sYID803ici,Feb 23 2020 
अख्तियार विधेयकमाथि समितिमा सकस https://t.co/SKHSruu3xE,Feb 23 2020 
राजपामा सरकार नजाने लाइन हाबी https://t.co/HrJZuuG6oL,Feb 23 2020 
अधिकार नहुँदा कर्मचारी भर्ना गर्न समस्या https://t.co/qZVCgomhMS,Feb 23 2020 
हेटौंडामा प्रदेशस्तरीय सुरक्षा गोष्ठी https://t.co/ouLCe0I3GI,Feb 23 2020 
हिमालयन र जावलाखेलबीच उपाधि भिडन्त https://t.co/6Ha2bfrpOl,Feb 23 2020 
तेस्रो पटक एपिएफलाई उपाधि https://t.co/XgcwGgQVYX,Feb 23 2020 
पहिलो खेलमै आयोजक पराजित https://t.co/my7FoYJWYN,Feb 23 2020 
सार्वजनिक सुनुवाइमा पनि सत्ता र प्रतिपक्ष https://t.co/ivDbi28kqL,Feb 23 2020 
एमआरपीमा पनि जिटुजी तयारी https://t.co/FlkmZLHypo,Feb 23 2020 
प्रहरीको भ्यानलाई ट्रकले ठक्कर दिँदा ४ असईसहित ६ जना घाइते https://t.co/Fd722vJPpi,Feb 23 2020 
गौतमलाई राष्ट्रियसभामा लैजाने प्रस्ताव https://t.co/5JBzIC58km,Feb 23 2020 
सिद्धिचरण र सगरमाथा लोकमार्गमा ‘टाईमकार्ड’ लागू गरिदै https://t.co/91XeWVgyLE,Feb 22 2020 
दुई तिहाईको सरकार पूर्णरुपमा असफल : उपेन्द्र यादव https://t.co/HpqyG8PVCk,Feb 22 2020 
नेकपा सचिवालय बैठक : एमसिसी बारे निर्णय हुन सकेन https://t.co/5RlWktvTX0,Feb 22 2020 
तीर्थले पाँचौ पटक जिते धरान रनको उपाधि https://t.co/nvEI7qusvj,Feb 22 2020 
मोडेलिङमा जम्दै जाजरकोटका अभि https://t.co/meofsPizZK,Feb 22 2020 
डोलेश्वरबाट बिदा भए साधुसन्त https://t.co/LOGoiYp3bm,Feb 22 2020 
समृद्धिका लागि सन्तुलित छिमेक नीति आवश्यक : प्रधानमन्त्री https://t.co/a05GyavWoj,Feb 22 2020 
'भिजन टु एक्सन' पुस्तक सार्वजनिक https://t.co/xrCbqhhTwN,Feb 22 2020 
इरानमा पनि कोरोनाबाट पाँच जनाको मृत्यु https://t.co/t2QtEXXd7u,Feb 22 2020 
साताको शेयर बजारः आठ अर्ब ६९ करोडको कारोवार https://t.co/4fvbfHSyea,Feb 22 2020 
गल्ती गर्ने छुट कसैलाई छैनः अध्यक्ष दाहाल https://t.co/QEXlhf9De9,Feb 22 2020 
एक सय २९ विद्यार्थी इन्जिनियर उपाधिबाट दिक्षित https://t.co/xHY4YJ7ZLy,Feb 22 2020 
‘पार्टी मिल्यो भावना मिलेन’ https://t.co/nz9KzUxEt2,Feb 22 2020 
आयोजक भक्तपुर नगरपालिकाको वर्चस्व https://t.co/ycYvIVTVt7,Feb 22 2020 
राजभण्डारी परिवारले बनाइदिए घाट र विश्रामस्थल https://t.co/TnufKY2X51,Feb 22 2020 
सेना दिवसमा फुटबल https://t.co/tuQsw4oaVH,Feb 22 2020 
विद्यालय सुधार्दै व्यवस्थापन समिति https://t.co/0lM1VYdKeN,Feb 22 2020 
छुई प्रथा हटाउन महायज्ञ https://t.co/Aq8DqA4hD3,Feb 22 2020 
सिद्धार्थनगरमा व्यवस्थित 'डम्पिङ साइड' नहुँदा समस्या https://t.co/hBNl4bJ4ur,Feb 22 2020 
नशालु पर्दाथ प्रयोग गरिएको १ सय ३० लिटर घोट्टा नियन्त्रणमा https://t.co/4hXao7EUkz,Feb 22 2020 
‘रक गार्डेन’ बनाउँदै नगरपालिका https://t.co/HHos1XvPFo,Feb 22 2020 
कालोपत्रेको काम सुचारु गराउने सहमति https://t.co/Yb42Ag6qUM,Feb 22 2020 
तीनकुनेको अतिक्रमित जग्गामा डोजर चल्यो https://t.co/Xbk6zMBffG,Feb 22 2020 
उद्योग गरौँ उद्यमी बनौँ : उठाउ नेपाललाई https://t.co/Whvp5qBpHA,Feb 22 2020 
विकट गाउँमा लिफ्ट खानेपानी आयोजना शुरु https://t.co/egvYnEkCL9,Feb 22 2020 
एमसिसी परिमार्जनसहित अनुमोदन हुन्छ : अध्यक्ष दाहाल https://t.co/cyKyvibtzz,Feb 22 2020 
छोरी बीमा गर्नेलाई तीन महिना नि शुल्क इन्टरनेट सेवा https://t.co/J8K1q5np1y,Feb 22 2020 
सरकार चलाउने नैतिकता समाप्त भइसक्योः शेखर कोइराला https://t.co/QhMRzMMtyT,Feb 22 2020 
कर्णालीमा कृषि: माग बढ्दो उत्पादन घट्दो https://t.co/DSJsLG2fDi,Feb 22 2020 
यौन तथा प्रजनन शिक्षामा छुट्टै पाठ्यक्रम बनाउन माग https://t.co/mYDM6WAKJh,Feb 22 2020 
लडाकुको पारिश्रमिकबाट सुरु लुटयात्रा बाँस्कोटासम्म पुग्योः कमल थापा https://t.co/gwA28eQcTC,Feb 22 2020 
सत्यं शिवं सुन्दरम https://t.co/ad30YeatuO,Feb 22 2020 
उठ न उठ सिलोकेदाइ हो पूर्वै उज्यालो भयो https://t.co/9bLKNeppBl,Feb 22 2020 
सुर्तीजन्य पदार्थ र फोक्सो स्वास्थ्य https://t.co/EmdbNk73W8,Feb 22 2020 
'फुच्ची नानी सूर्य भेट्न गइन्' https://t.co/fE5fTLN4IC,Feb 22 2020 
हाम्रो विद्यालयको अभिभावक दिवस https://t.co/KG7ov6FiCF,Feb 22 2020 
चाँगुनारायण घुम्दा https://t.co/fchTMnTjj4,Feb 22 2020 
मेरो देश चिनाउने काम गर्ने छु https://t.co/AZTPnaCZXU,Feb 22 2020 
हिउँचुलीसँग मालिकाको पिरती https://t.co/qPmCEFvcSG,Feb 22 2020 
शिवरात्रिमा साधुसन्त https://t.co/UfXwRMkAX6,Feb 22 2020 
गौतम बुद्धका आमा र छोराछोरीहरू https://t.co/TyFDIdRtLJ,Feb 22 2020 
ग्रेटवाल हेर्ने रहर https://t.co/lTC1thuuL4,Feb 22 2020 
कुलदेवतालाई परिकार चढाएर मनाइने ग्याल्बु ल्होसार https://t.co/CsMHeUkSrw,Feb 22 2020 
सुन्दर बस्ती जर्जर जिन्दगी https://t.co/2oPqkS4QTL,Feb 22 2020 
‘विद्यार्थीले बुझ्ने भाषामा पढाइनुपर्छ’ https://t.co/rGoonciD8n,Feb 22 2020 
‘बच्चा जोखौं नुन बोकौं’ अभियान सुरु https://t.co/fjYWChoZqn,Feb 22 2020 
सेनाको निःशुल्क स्वास्थ्य शिविर https://t.co/74D7rsmoan,Feb 22 2020 
गर्भपतनको राजनीति https://t.co/78xbUByMlG,Feb 22 2020 
शनिबारदेखि बुढा सुब्बा गोल्डकप https://t.co/EFlYfw8mqa,Feb 22 2020 
कोरोना भाइरसको कति बाँच्छ? https://t.co/96DmVdjoZx,Feb 22 2020 
आमाशय र ठूलो आन्द्राको क्यान्सर बढेको छ https://t.co/EBbJ5X7Ofl,Feb 22 2020 
त्यो रुकुम यो रुकुम https://t.co/eGe0m75ftL,Feb 22 2020 
उद्योगका नाममा महाभारत पहाड दोहन https://t.co/da3B6uSMEg,Feb 22 2020 
आर्किटेक्चर डिजाइनमा अवधारणा विकासबारे कार्यशाला https://t.co/9uixZhns1f,Feb 22 2020 
‘पश्चिमी पहाडी क्षेत्रमा हल्का वर्षाको सम्भावना’ https://t.co/TKy0kHHOIQ,Feb 22 2020 
राधा माधव समितिले सयभन्दा बढी ठाउँको भ्रमण गर्ने https://t.co/CYgq8Lj9G5,Feb 22 2020 
हर्षोल्लाससाथ मनाइयो महाशिवरात्रि https://t.co/BEHTomwSfK,Feb 22 2020 
फूलैफूलले सजियो पशुपति https://t.co/M7XEASrQ4l,Feb 22 2020 
पेनाल्टी सुटआउटमा कञ्चनजंघा भाग्यशाली https://t.co/FlRy9YIfod,Feb 22 2020 
सार्वजनिक सुनुवाइमा सत्ता र प्रतिपक्ष https://t.co/bj8TAjliG1,Feb 22 2020 
मच्छिन्द्र र थ्री स्टारबीच उपाधि भिडन्त https://t.co/82E584KXM0,Feb 22 2020 
साग पदकविजेता सम्मानित https://t.co/0fQSV9qkyG,Feb 22 2020 
शिक्षामा लैंगिक विभेद: छोरा स्कुल छोरीलाई घरधन्दा https://t.co/f5KVo5dSZn,Feb 22 2020 
दस हजार मिटरमा धर्म प्रथम https://t.co/AN1rey3G6L,Feb 22 2020 
झापामा पनि सरकारी जमिन अतिक्रमण https://t.co/WFRsFKbtNL,Feb 22 2020 
टेनिस टोली इन्डोनेसियातर्फ https://t.co/xD8IWwuTsR,Feb 22 2020 
नवप्रवर्तनीय उद्योगलाई अनुदान https://t.co/1ZKI5iowxV,Feb 22 2020 
वर्षाले फाइनल सर्‍यो https://t.co/WbV6GdMSFk,Feb 22 2020 
एमसिसी पारित गर्न अमेरिकी दबाब https://t.co/ocwGCOMiZF,Feb 22 2020 
हिमालयन शेर्पा फाइनलमा https://t.co/H3Akrh8sRW,Feb 22 2020 
एमसिसी संशोधनपछि मात्र अनुमोदन: नेकपा कार्यदल https://t.co/FMK5NzI7S0,Feb 22 2020 
एमसिसी कार्यदलले प्रतिवेदन बुझायो https://t.co/hgYWbCyXWW,Feb 21 2020 
हिउँमा फसेका यात्रुलाई सुरक्षाकर्मीद्धारा उद्धार https://t.co/z1snPEkqY7,Feb 21 2020 
मातृभाषा दिवसमा बज्जिकाको दुई प्रकृतिका कार्यक्रम सम्पन्न https://t.co/MGCzT7fqJS,Feb 21 2020 
साग पदक विजेता सम्मानित https://t.co/ayp41M516z,Feb 21 2020 
सार्वजनिक सुनुवाईमै ‘सत्तापक्ष र प्रतिपक्ष’ https://t.co/FAi5dCRsFj,Feb 21 2020 
कर्णाली तरेर आउने ५५ विद्यार्थीलाई लाइफ ज्याकेट https://t.co/i1XW1MWydN,Feb 21 2020 
पार्टीबाट बिश्राम लिई कृषिमा जम्दै https://t.co/uMmV4BepWD,Feb 21 2020 
सर्लाहीको चितायनमा हजारौं भाण्टाको भार र धानको मट्का चढाईयो https://t.co/xPRlzVXNHp,Feb 21 2020 
उपप्रमुखद्वारा सरकारी गाडीको दुरुपयोग https://t.co/CbFn54Cwp8,Feb 21 2020 
रुपन्देहीमा जन्ती बस दुर्घटना सात घाइते https://t.co/QddxT8rjsD,Feb 21 2020 
विरपूर्खा र इतिहासलाई सम्मान गरौं : प्रधानमन्त्री ओली https://t.co/7UB35hE3v9,Feb 21 2020 
गोकुल बास्कोटा प्रवृत्ति : राजनीतिको विकृतरुप https://t.co/E0ILDaByYg by @prasantaparbat,Feb 21 2020 
यसरी मनाइयो नेपाली सेना दिवस (फोटोफिचर) https://t.co/6r2BE2lzNo,Feb 21 2020 
एमसिसी कार्यदलको प्रतिवेदन तयार https://t.co/fyRlQ6PF8u,Feb 21 2020 
चिनियाँ जेलमा पनि देखियो कोरोना भाइरसको सङ्क्रमण https://t.co/OnmWlJJ97z,Feb 21 2020 
जुम्लामा हिमपात https://t.co/c3G3GM1M7E,Feb 21 2020 
गाउँपालिकामा सेनाको स्वास्थ्य शिबिर https://t.co/GiUp23A4cM,Feb 21 2020 
पञ्चेवाजाको राग संरक्षणका लागि वाजागाजा वितरण https://t.co/jKMvjYxkZS,Feb 21 2020 
देशभर महाशिवरात्रि पर्व मनाइदै । https://t.co/Lx5zUX58Zg https://t.co/eXbkjN9A5W,Feb 21 2020 
दुई लाख घुससहित प्राविधिक पक्राउ https://t.co/VLEZHWOIVb,Feb 21 2020 
‘पिर्के सलामी’को डर ! https://t.co/yLbla0AX3m,Feb 21 2020 
आशा जगाउदै मिक्लाजुङ https://t.co/sFqRsiZWnX,Feb 21 2020 
कम्युनिष्टहरु सत्तामा पुगेपछि भ्रष्टाचारमा लिप्त हुन्छन् । https://t.co/nt2SwejbgF https://t.co/CaWOvFxSR1,Feb 21 2020 
कांग्रेस र मधेशवादी दलका कार्यकर्ताबीच झडप आधा दर्जन घाइते https://t.co/JngKyllKkw,Feb 21 2020 
मन्त्रीलाई कारबाही गर्न जनप्रतिनिधिहरूको माग https://t.co/FfYPuxNHzV,Feb 21 2020 
दाहालले भने : कम्युनिष्टहरु सत्तामा पुगेपछि भ्रष्टाचारमा लिप्त हुन्छन् https://t.co/2YdfIEBcgn,Feb 21 2020 
शिवरात्रिको रौनक (फोटोफिचर) https://t.co/GnJrEaRq0U,Feb 21 2020 
जुवा खेल्दै गरेका प्रधानाध्यापकसहित आठ पक्राउ https://t.co/6ufICd7TBG,Feb 21 2020 
गाँजा सेवन गर्न नपाउने भएपछि हराए भोलेबाबा https://t.co/Xui0D7QMAJ,Feb 21 2020 
भव्य र उल्लासमय ढंगले ताप्लेजुङमा महोत्सव सुरु https://t.co/wi5IRdnm9U,Feb 21 2020 
गाँजा सेवन गर्न नपाउने भएपछि हराए भोलेबाबा https://t.co/wmgeGSb1Qi,Feb 21 2020 
बाँस्कोटाको बहिर्गमन https://t.co/hU8rwfKSBy,Feb 21 2020 
कोरोनामा हराएको करुणा https://t.co/Zj0xLOhBCf,Feb 21 2020 
राष्ट्रघातीलाई सलाम ! https://t.co/4lJ3tR9DcR,Feb 21 2020 
चिनियाँ घाउमा नुनचुक https://t.co/YqmeGeAwG7,Feb 21 2020 
एमसिसी अनुमोदन हुन्छ : अर्थमन्त्री https://t.co/TMDrRJ3oFW,Feb 21 2020 
सेना दिवसको सान्दर्भिकता https://t.co/Ub2c7GOIPQ,Feb 21 2020 
निष्पक्ष छानबिनको माग https://t.co/TgO6eNbOZm,Feb 21 2020 
कोरोना प्रभावले अधिकांश होटलका बुकिङ रद्द https://t.co/NoQaS9KeSF,Feb 21 2020 
फेसन इन्स्टिच्युटले माफी माग्यो https://t.co/gjmkHNSao2,Feb 21 2020 
तीन महिना काम गरेर साउदीबाट रित्तो हात https://t.co/VIUes8dZb3,Feb 21 2020 
मनीषासहित १० जनालाई नइ पुरस्कार https://t.co/5rMRi492go,Feb 21 2020 
‘दासढुंगा २ प्रति सरकारले आपत्ति जनाउनु गलत’ https://t.co/yM7osdC5Lh,Feb 21 2020 
फिल्म सुटिङमा तीनको मृत्यु https://t.co/nF5oAVQF4k,Feb 21 2020 
खोलाको खाल्टो सम्याउन पत्राचार https://t.co/U2550corTo,Feb 21 2020 
४० प्रतिशत काम सम्पन्न https://t.co/X7v0Vom98I,Feb 21 2020 
अपांगता भएका व्यक्तिलाई परिचयपत्र https://t.co/5bKauW54BY,Feb 21 2020 
उपमहानगरले घर भत्काएपछि सुकुम्बासीको बिचल्ली https://t.co/ScFhKZpmpV,Feb 21 2020 
स्थानीयद्धारा सडक कालोपेत्रको काम ठप्प https://t.co/jY67Jc45Ag,Feb 21 2020 
उपकुलपति नियुक्ति अलमल https://t.co/KJjlPdYMQY,Feb 21 2020 
मर्यादाविपरीत काम गर्ने शिक्षक सरुवा https://t.co/sPZotB8X3s,Feb 21 2020 
साँगामा महाशिवरात्रि चहलपहल https://t.co/1NZA3xuNdf,Feb 21 2020 
शिवरात्रिमा सकेसम्म कम धुनी बाल्न अनुरोध https://t.co/OXlG7D4eWO,Feb 21 2020 
ल्होसार मनाउन लाङटाङ र क्यान्जिनका होटल व्यवसायी काठमाडौंमा https://t.co/cyBQmJ5Trd,Feb 21 2020 
न्यायपालिका अन्तिम आशा https://t.co/PNa8twFEok,Feb 21 2020 
प्रदर्शनका क्रममा नेवि संघका १० जना घाइते https://t.co/Yrbca6ThZb,Feb 21 2020 
अन्नपूर्ण फेरोको विकल्प सेभेन पास सर्किट https://t.co/nW0ljEzXTk,Feb 21 2020 
भीमेश्वरको शिलामा पसिना https://t.co/BTxySiGPER,Feb 21 2020 
परिसंघ टोली र अर्थ सचिवबीच छलफल https://t.co/DNEMLVAzQh,Feb 21 2020 
‘महिलालाई सशक्त बनाउन आवश्यक’ https://t.co/qa7tweQhLp,Feb 21 2020 
अमेरिकी सांसद टोली नेपालमा https://t.co/5jAabkOWam,Feb 21 2020 
दुुवै सदन अवरुद्ध https://t.co/aFpuhlHB8y,Feb 21 2020 
चीनमा नयाँ संक्रमण घट्दो : चिनियाँ अधिकारी https://t.co/F9jqOKw6E4,Feb 21 2020 
बाँस्कोटाको अभिव्यक्तिप्रति कर्मचारी आक्रोशित https://t.co/buJcxHJFTI,Feb 21 2020 
भारतमा सवारी दुर्घटनामा ६ नेपालीसहित २६ को मृत्यु https://t.co/dC1sXXhEU1,Feb 21 2020 
एमसिसीविरुद्ध नेमकिपाले प्रदर्शन गर्ने https://t.co/NkG4b9WLid,Feb 21 2020 
दक्षिण कोरियामा २५ लाख मानिसलाई घरभित्र बस्न आग्रह https://t.co/tkS9yWNBiq,Feb 21 2020 
जर्मनीको दुईवटा बारमा गोली चल्दा नौ जनाको मृत्यु https://t.co/SMNuTMFOjQ,Feb 21 2020 
गुजरातमा महिनावारी परीक्षणको नाममा छात्रामाथि दुर्व्यवहारको विरोध https://t.co/QGhoSRzubE,Feb 21 2020 
प्रहरीलाई उत्साहित हुन आग्रह https://t.co/ZULK0mgnif,Feb 21 2020 
आज महाशिबरात्रि: पशुपतिमा उत्सव र उल्लास https://t.co/G1fLqwz4sf,Feb 21 2020 
पोखरा राइनोजमा मुन्से https://t.co/NDmfFjpeA6,Feb 21 2020 
जापानी टोली नआउने https://t.co/BSrkolXGeE,Feb 21 2020 
बाँस्कोटा पद गुमाउने नवौं मन्त्री https://t.co/Vm6BUrCvgb,Feb 21 2020 
बक्सिङ खेलाडी छनोट https://t.co/f0KuBgKlNM,Feb 21 2020 
प्रतिबद्धता बिर्संदै मधेसवादी दल https://t.co/YudfT39TSh,Feb 21 2020 
दुई पुलिसबीच उपाधि भिडन्त https://t.co/vqUnNtzNlH,Feb 21 2020 
घुस बार्गेनिङले बाँस्कोटाको बहिर्गमन https://t.co/JckZu9BWd5,Feb 21 2020 
थ्री स्टार फाइनलमा https://t.co/liwk1HFqT8,Feb 21 2020 
अर्थमन्त्रीलाई सञ्चार मन्त्रालयको पनि जिम्मेवारी https://t.co/oY4ybp2PWB,Feb 21 2020 
ह्वाइट हाउस च्याम्पियन https://t.co/zkqNsq3pXF,Feb 21 2020 
सेमिफाइनल समीकरण पूरा https://t.co/3sfPmvrDii,Feb 21 2020 
खप्तड गोल्डकपको तयारी पूरा https://t.co/ZtDWxfqbBM,Feb 21 2020 
घुस बार्गेनिङमा यस्तो छ https://t.co/8Z7eXh3s2I,Feb 21 2020 
'मन्त्री नै यतीको एजेन्ट' https://t.co/V6mi63c4Z3,Feb 21 2020 
उपमहानगरले घर भत्काएपछि सुकुम्बासीको बिचल्ली https://t.co/TzRFYtlYzk,Feb 20 2020 
