Tweet,Date
सर्‍यो ‘नो टाइम टु डाई’ को रिलिज https://t.co/0BH0b7hQwJ,Mar 06 2020 
सहाराको विजयी सुरुआत https://t.co/EZ8dQmqhVI,Mar 06 2020 
खेलकुद प्रतियोगिता राेक्न निर्देशन https://t.co/xJWNZaBYBE,Mar 06 2020 
शंकरनगरलाई उपाधि https://t.co/jBs29ZCscZ,Mar 06 2020 
ब्वाइज युनियन विजयी https://t.co/ojqtnqsz9P,Mar 06 2020 
यसकारण हटाइए लीलामणि https://t.co/vzf8K7hfkq,Mar 06 2020 
क्यालिफोर्नियामा आपतकाल घोषणा मृतकको संख्या तीन हजार तीन सय नाघ्यो https://t.co/pQwFkHSz0d,Mar 06 2020 
ग्रिसले अवैध आप्रवासीलाई फिर्ता पठाउने कास्टानिज https://t.co/FRCODpbTgG,Mar 06 2020 
टुसालको फराकिलो जित https://t.co/fMbt0wqgwW,Mar 06 2020 
अमेरिकी राष्ट्रपतीय चुनाव माइकल ब्लुमबर्ग चुनावी दौडबाट बाहिरिए https://t.co/ML3ua4mRD6,Mar 06 2020 
राष्ट्रसंघका पूर्वमहासचिवको निधन https://t.co/1cqa9Sd9Vf,Mar 06 2020 
टुसालको फराकिलो जित https://t.co/sLiet9cWNy,Mar 06 2020 
मिर्गौला दातामा महिला बढी https://t.co/LTR8vZMEyD,Mar 06 2020 
आयोजक पहिलो पटक फाइनलमा https://t.co/ICpsnR1U2t,Mar 06 2020 
ब्वाइज युनियन विजयी https://t.co/zJZukra5IW,Mar 06 2020 
‘प्रधानमन्त्रीलाई झोलिलो खाना’ https://t.co/BFA2wFRjf1,Mar 06 2020 
प्रहरी छैनन् कोरोनाबारे सचेत https://t.co/9qX3HHFqhY,Mar 06 2020 
चार बालबालिका फेला https://t.co/Tq4lfuLkqK,Mar 05 2020 
खारम्बुको विजयी सुरुवात https://t.co/HVFiBo3GkP,Mar 05 2020 
स्वास्थ्यकर्मीलाई बिदामा नबस्न निर्देशन https://t.co/GyYXa0k85V,Mar 05 2020 
बन्दुक र गोलीसहित एक जना पक्राउ https://t.co/0YnbtKm0EF,Mar 05 2020 
गोरखाको प्रभा माविका विद्यार्थीमा भाइरलको संक्रमण https://t.co/Fd2gMm22mT,Mar 05 2020 
विप्लव समूहको जनकपुर ब्यूरो सदस्यद्वारा आत्मसर्मपण https://t.co/o06P3xd0kC,Mar 05 2020 
सैनिक आवासीयलाई प्रधानसेनापति अन्तर विद्यालय टी-२० क्रिकेटको उपाधि https://t.co/U1K1qdujej,Mar 05 2020 
सशस्त्र प्रहरीद्वारा लाखौको गाँजा बरामद https://t.co/uRv4ydvHFm,Mar 05 2020 
बाक्सिला गोल्डकप सुरु https://t.co/IDfGKkM7o2,Mar 05 2020 
शंकरनगरलाई एसियन च्यालेन्जर ट्रफी ट्वान्टी–२० क्रिकेटकाे उपाधि https://t.co/yyUtbJ5vcc,Mar 05 2020 
भारतीय राजदूतले राष्ट्रपतिसमक्ष बुझाए ओहोदाको प्रमाणपत्र https://t.co/Q0jaaTcDGW,Mar 05 2020 
मास्ककाे कालाेबजारी : ८० पर्नेलाई ४५० रुपैयाँ ! https://t.co/AHcJkyvDHB,Mar 05 2020 
२५ लाख घुस लिएको आरोपमा गाउँपालिका अध्यक्ष र वडाध्यक्षविरुद्ध मुद्दा दायर https://t.co/hKLkFuuFZC,Mar 05 2020 
प्रधानमन्त्रीको स्वास्थ्यमा अपेक्षाकृत सुधार प्रत्यारोपित मिर्गौलाले काम गर्न थाल्यो https://t.co/h2MYbP3Nqo,Mar 05 2020 
छात्रावासमा आगलागी हुँदा २५ लाखको क्षति https://t.co/1yn6uj41Iq,Mar 05 2020 
जिल्ला अस्पताल रसुवामा आइसोलेसन कक्षको स्थापना https://t.co/NMx4hbksA7,Mar 05 2020 
सम्बन्ध विच्छेद बलात्कार र लागुऔषध भयावह https://t.co/l0zQR6HyJw,Mar 05 2020 
कोरोना कहर : ईपीएल क्रिकेट स्थगित https://t.co/NvwrHgMlOE,Mar 05 2020 
सरकारले कोरोना रोकथाम गर्न सीमामा क्वारेन्टाइन भवन निर्माण गर्ने https://t.co/6PHxaSt7YC,Mar 05 2020 
विप्लवका जिल्ला सदस्य हतियारसहित पक्राउ https://t.co/Fu9puToqxC,Mar 05 2020 
कर्णाली प्रतिष्ठानको चिकित्सक टोली हुम्लामा https://t.co/712V5PY8Ea,Mar 05 2020 
नेपाली सेनाभित्रको भ्रष्टाचारको छलफलमा रक्षामन्त्री र प्रधानसेनापति नआउदा बैठक स्थगित https://t.co/IKiDf4CZeQ,Mar 05 2020 
देउडाबाटै पोषण सन्देश छर्दै https://t.co/1rc9Fninis,Mar 05 2020 
होली उत्सव मेलामा नजान प्रशासनको आग्रह https://t.co/6ErSG0bYqx,Mar 05 2020 
कोरोना कहरः उदयपुरमा होली खेल्न निषेध https://t.co/FCgockRfex,Mar 05 2020 
विप्लव कार्यकर्ताद्वारा ६ वटा गाडीमा आगजनी https://t.co/Z0qjvEftJ1,Mar 05 2020 
सम्झना https://t.co/MC4xoq7Bv6,Mar 05 2020 
मध्यपूर्वमा कोरोनाको सन्त्रास नेपाली चिन्तित https://t.co/gHTrHJp5dx,Mar 05 2020 
प्रधानमन्त्री ओलीको स्वास्थ्यमा क्रमिक सुधार https://t.co/1U4vPldvn7,Mar 05 2020 
टाटा पिकअपको ठक्करबाट एक जनाको मृत्यु  एक घाइते https://t.co/rwr33x38Q8,Mar 05 2020 
गोरखा जीप दुर्घटनामा घाइतेलाई सेनाको हेलिकप्टरबाट काठमाण्डौँ लगियो https://t.co/w5xJDFO4ur,Mar 05 2020 
अपूरो पढाइमा वार्षिक परीक्षा https://t.co/488rSC9g70,Mar 05 2020 
भीम लिंग दर्शन https://t.co/GBaV6xPwsI,Mar 05 2020 
सञ्जेलले सफाइ पाए https://t.co/6Mhd2jVSR5,Mar 05 2020 
सर्वनाममा मानसिक अस्पताल https://t.co/QROQR33x5j,Mar 05 2020 
नम्बरप्लेट स्पष्ट नभएका सवारी कारबाहीमा https://t.co/EfgMygxZil,Mar 05 2020 
धमाधम कार्यक्रम स्थगित https://t.co/xU2UIr2rw1,Mar 05 2020 
सौराहाका होटल कर्मचारीलाई बिदा दिइँदै https://t.co/FutjvzBnE3,Mar 05 2020 
नेकपाको मुटु https://t.co/JvYLsKkqQ9,Mar 05 2020 
सिरिया शान्तिमा फेरि बादल https://t.co/bXGtKaoW6e,Mar 05 2020 
सात महिनामा डेढ अर्बको विद्युतीय गाडी आयात https://t.co/VUTIE7764r,Mar 05 2020 
सञ्चालन अझै अनिश्चित https://t.co/gN5B82ZYyE,Mar 05 2020 
गाडी आयात २० प्रतिशत घट्यो https://t.co/d6dVNKGCmm,Mar 05 2020 
पूर्वडिएसपी पक्राउ https://t.co/0SF8mW0PBL,Mar 05 2020 
कोरोना रोक्न नाकामा सतर्कता https://t.co/YuakWuMs14,Mar 05 2020 
१५ दिनभित्र व्यवसाय दर्ता गर्न निर्देशन https://t.co/ZLmt98pg7m,Mar 05 2020 
कोरोना त्रास: अपूरो संरचनामा पूर्व तयारी https://t.co/ESeCh2WmEO,Mar 05 2020 
मान्बु जीप दुर्घटनाका घाइतेको उपचारमा समस्या हेलिकप्टर कुर्दै छटपटाउँदै https://t.co/Fh1xbLo7io,Mar 05 2020 
किसानलाई फलफूलका बिरुवा वितरण https://t.co/jk858QxT84,Mar 05 2020 
‘नियम मिचिएको’ नियुक्तिविरुद्ध प्राध्यापकहरू आन्दोलित https://t.co/UbFB3veaSb,Mar 05 2020 
होटल इच्छालाई पाँचतारेमा स्तरोन्नति गरिँदै https://t.co/kfx0EAZeoH,Mar 05 2020 
पत्रकार डेकेन्द्र हत्या प्रकरण: १५ वर्षपछि मुख्य आरोपी पक्राउ https://t.co/cHcTDmwWEx,Mar 05 2020 
साहित्यकारलाई अभिनन्दन गरिने https://t.co/pFZyPGRpNP,Mar 05 2020 
सिपिङ कम्पनीको अब फुल प्याकेज अफर https://t.co/lxA4Q2Mv3T,Mar 05 2020 
मिस वर्ल्ड नेपालमा https://t.co/uc2vZmH35J,Mar 05 2020 
कोरोना संक्रमणको त्रास फिल्म र सभा हल बन्द नहुने https://t.co/HkpiLxroGi,Mar 05 2020 
कोरोनाविरुद्ध सर्वाेच्चमा विशेष सतर्कता https://t.co/OGHS4KBSwW,Mar 05 2020 
सिपिङ कम्पनीको अब फुल प्याकेज अफर https://t.co/huGMFP67Ii,Mar 05 2020 
राष्ट्रियसभामा नेकपाको वर्चस्व https://t.co/QvV4QIQTYL,Mar 05 2020 
असन्तुष्ट पक्षद्वारा प्रशिक्षण बहिस्कार https://t.co/gUF2J8njTw,Mar 05 2020 
कोरोना संक्रमण त्रास इरानमा ५४ हजार कैदी रिहा https://t.co/TXdT63JWJz,Mar 05 2020 
डेमोक्रेटिकको ‘प्राइमरी’ चुनावमा बाइडेनको फराकिलो अग्रता https://t.co/nkKyIXRIKv,Mar 05 2020 
इजरायल आमनिर्वाचनमा नेतान्याहुको दललाई अग्रता बहुमत पुगेन https://t.co/QqAnnIcBFq,Mar 05 2020 
तालिबान लडाकुकाे आक्रमणमा १९ सैनिक मारिए https://t.co/bjEm8PEK6D,Mar 05 2020 
अमेरिकामा आँधीबाट दुई दर्जनको मृत्यु https://t.co/MS8ailHc9W,Mar 05 2020 
नेपाल समूहचरणबाटै बाहिर https://t.co/D1xGkrvqEU,Mar 05 2020 
'नेपाल रत्न' पाउनेलाई मन्त्रीसरह सुविधा https://t.co/unf0RUATDP,Mar 05 2020 
अर्थतन्त्रमा कोरोना त्रासदी लम्बिए आर्थिक वृद्धि पाँच प्रतिशतभन्दा तल https://t.co/RCU2HuIeg9,Mar 05 2020 
शिवरामलाई उपाधि https://t.co/crADK8Z2ca,Mar 05 2020 
गोरखामा जीप दुर्घटना हुँदा वडा सचिवको मृत्यु गाउँपालिका उपाध्यक्ष सहित ७ घाइते https://t.co/Wk7OAQwetl,Mar 05 2020 
मकाउका चियोङ सम्मानित https://t.co/QL8c3pW2ik,Mar 05 2020 
प्रधानमन्त्रीको मिर्गौला प्रत्यारोपण https://t.co/dl9KDgVHxM,Mar 05 2020 
'जे हुन्छ राम्रै हुन्छ।’ https://t.co/RUoYzmY5gu,Mar 05 2020 
कोरोना त्रास : महोत्सव भेला गर्न रोक https://t.co/EKy0ZeIlNI,Mar 04 2020 
बुटवलमा घरेलु साना तथा औद्याेगिक महोत्सव सुरू https://t.co/aIYpnM08ZV,Mar 04 2020 
नेकपाद्वारा ठूला भेला र जनसभा स्थागित https://t.co/JIpvOlJJk7,Mar 04 2020 
भक्तपुरमा भीमसेनको लामो लिंगको प्रदर्शन https://t.co/YNiWtaGNuV,Mar 04 2020 
प्रदेश सभा सदस्य बलात्कार आरोपमा पक्राउ https://t.co/ibcahToisV,Mar 04 2020 
माइभ्याली गोल्डकप : मच्छिन्द्र फाइनलमा https://t.co/GeTh5ID53U,Mar 04 2020 
नरैनापुर गाउँपालिकाविरुद्ध दायर गरिएको रिट खारेज https://t.co/K1xp9XgMZz,Mar 04 2020 
पदभार सम्हाल्दै अर्थमन्त्रीले भने : 'कमाण्डरले फिर्ता नबोलाउदासम्म लडिरहन्छु' https://t.co/hGOo4nAzWC,Mar 04 2020 
जीप दुर्घटनामा एकको मृत्यु १० जना घाइते https://t.co/xqjXTuQzZP,Mar 04 2020 
महानायक हमाल तिलौराकोटमा https://t.co/1YRHzYkYUy,Mar 04 2020 
प्रधानमन्त्रीलाई एक सातासम्म चिकित्सक बाहेक अरुले भेट्न नमिल्ने https://t.co/7qlznTLKeH,Mar 04 2020 
राइनोज र शंकरनगर फाइनलमा भिड्दै https://t.co/gL8iLmb3wg,Mar 04 2020 
'जनताको माग संवोधन हुनुपर्‍यो नभए मर्न तयार छौँ' https://t.co/AnZV3P71Ge,Mar 04 2020 
छलफल गरियोस् भन्ने प्रस्ताव स्वीकृत https://t.co/nEUZQ9gi2e,Mar 04 2020 
निर्माणाधिन पुलको फर्मा भाचिँदा तीन जना घाइते https://t.co/MwbfxNbAkw,Mar 04 2020 
पन्ध्र दिनभित्र व्यवसाय दर्ता गर्न नगरपालिकाको निर्देशन https://t.co/nUZcV7gKK1,Mar 04 2020 
हङकङमा माक्स वितरण गर्दै खोटाङ्गेको हाइकिङ https://t.co/69x32256FS,Mar 04 2020 
प्रधानमन्त्रीलाई आईसीयूमा सारियो https://t.co/gAVeR97edl,Mar 04 2020 
प्रधानमन्त्रीको स्वास्थ्य अवस्था स्थिर : अस्पताल https://t.co/HEHTKHb3rh,Mar 04 2020 
प्रधानमन्त्रीलाई पोस्ट अपरेटिभ वार्डमा सारियो https://t.co/8Xbn4tnRI1,Mar 04 2020 
पौडेल पक्षद्वारा जिल्ला उपसभापतिको प्रशिक्षण बहिष्कार https://t.co/IhtnXwjyZx,Mar 04 2020 
साँघुरो बाटोमा ‘साइड’ दिँदा दुर्घटना https://t.co/PXhz0lPeAP,Mar 04 2020 
कोरोनाको महामारी प्रवेश हुन नदिन नेपालगन्ज नाकामा सतर्कता https://t.co/RXG7V54imh,Mar 04 2020 
बस्ती उठाएर बालुवा झिकिएको खानी बन्द गर्न निर्देशन https://t.co/NiCYP9ouas,Mar 04 2020 
प्रधानमन्त्री ओलीको मिर्गौला प्रत्यारोपण सफल https://t.co/ztzrkVMzuV,Mar 04 2020 
भुटानको याक पाँचथरमा https://t.co/B05yQju6M8,Mar 04 2020 
कोरोनाको त्रास : अन्र्तराष्ट्रिय महिला श्रमिक दिवस स्थगित https://t.co/3WqYhYIQZe,Mar 04 2020 
डोल्पाको विकट गाउँ रंगमा पुग्दै मोटरबाटो स्थानीयमा छाउदै खुसी https://t.co/rqQpvyOoEm,Mar 04 2020 
पत्रकार डेकेन्द्र हत्या प्रकरण : मुख्य आरोपित १५ वर्षपछि पक्राउ https://t.co/RTT6iTHa4q,Mar 04 2020 
कोरोना कहर पशुपतिनगर नाकामा स्वास्थ्य जाँच गरिँदै https://t.co/S38N6fgBo0,Mar 04 2020 
काेराेना प्रभाव : राष्ट्रिय साहित्य सम्मेलन स्थगित https://t.co/YFveoy00oU,Mar 04 2020 
डोल्पाको रोग प्रभावित क्षेत्रमा विशेषज्ञसहित चिकित्सकको टोली https://t.co/pwrqJqJhmS,Mar 04 2020 
उदयपुरका तीन स्थानीय तहमा १५ शैयाका अस्पताल बन्ने https://t.co/3PjOrdzaF0,Mar 04 2020 
प्रधानमन्त्री ओलीको सल्यक्रिया गर्न पाँच घण्टा लाग्ने https://t.co/cFuLlWfdnh,Mar 04 2020 
सुनको मूल्य अहिलेसम्मकै उच्च नयाँ रेकर्ड कायम https://t.co/8RD6s17H2P,Mar 04 2020 
स्कुल बसको ठक्करबाट बालकको मृत्यु https://t.co/Qhs8dTwauT,Mar 04 2020 
जीप दुर्घटना हुँदा चालकको मृत्यु https://t.co/FIHqciZkP3,Mar 04 2020 
जीप पल्टिदा १४ जना घाइते https://t.co/Cg8NZhAvLw,Mar 04 2020 
प्रधानमन्त्रीको मिर्गौला प्रत्यारोपण शुरु https://t.co/sMO8hrG1AU,Mar 04 2020 
छाउपडीविरुद्ध सरकारी अभियान : आठ हजार बढी छाउगोठ नष्ट https://t.co/6GMGrNxORr,Mar 04 2020 
पाकिस्तानका समकक्षीबाट स्वास्थ्यलाभको कामना https://t.co/ZDDXZrMYCG,Mar 04 2020 
हिजोमात्रै पदबाट राजीनामा दिएका खतिवडा आज अर्थ मन्त्रीमा नियुक्त https://t.co/LSBgrgq2cV,Mar 04 2020 
नागरिक निराशा https://t.co/mYZqWKPkDy,Mar 04 2020 
ओलीप्रति आशा https://t.co/CkWrqatmF2,Mar 04 2020 
कोरोना जोखिममा नेपाल https://t.co/JhiibnFgLz,Mar 04 2020 
दुई करोडसम्म ऋण लिन कर चुक्ता प्रमाणपत्र नचाहिने https://t.co/zQvennuiZn,Mar 04 2020 
जन्मदिनमा काटिने केक https://t.co/KszrdUWKry,Mar 04 2020 
अब स्मार्ट कृषि–प्रविधि https://t.co/RL5gaLSPT9,Mar 04 2020 
अन्तर्राष्ट्रिय हवाईसेवा बन्द गर्न माग https://t.co/4DnjFCEn1X,Mar 04 2020 
सुधारतर्फ एक पाइलाः बैंकर https://t.co/IcpUXIMA2Y,Mar 04 2020 
कोरोनाका कारण पौने ६ अर्ब घाटा बेहोर्दै फिल्म उद्योग https://t.co/izj6CeyMAI,Mar 04 2020 
नेपालबाट फर्किएका स्पेनी नागरिकको कोरोना भाइरसका कारण मृत्यु https://t.co/pBpIBGgRbx,Mar 04 2020 
'सरकारी धारणा प्रस्ट होस्' https://t.co/kAjxmdML7V,Mar 04 2020 
उखु अभावमा चिनी उद्योग बन्द https://t.co/Js3qh6yyoL,Mar 04 2020 
१० बुँदे घोषणापत्र जारी गर्दै सकियो सुकुटे महोत्सव https://t.co/VCYN3Ku996,Mar 04 2020 
स्थानीयलाई विश्वास दिलाउन जापानी स्वयंसेवक प्रभावकारी https://t.co/PhsPOvvMp5,Mar 04 2020 
‘नो टाइम टु डाई’ को रिलिज सार्न आग्रह https://t.co/F2TAkXMe4Y,Mar 04 2020 
क्यामरुनमा पृथकतावादीहरू मारिए https://t.co/VMKHzox6Fd,Mar 04 2020 
नेपालसहित २४ देशलाई अमेरिकी सहयोग https://t.co/WsQeIIb5VL,Mar 04 2020 
मिथिलाञ्चलमा होलीको रौनक सुरु https://t.co/PhjPkeRCWQ,Mar 04 2020 
कृषिजन्य उपज बंगलादेश निर्यातको पहल भएन https://t.co/7wjkyrLLHw,Mar 04 2020 
‘नेपाली फिल्म निर्माणमा चुनौती छ’ https://t.co/h9F084QWw6,Mar 04 2020 
समन्वय अभावले वित्तीय हस्तान्तरणमा जटिलता https://t.co/FlSl5pyTEn,Mar 04 2020 
क्यानभासमा पाँच देशका कला https://t.co/rdhWOG5FDu,Mar 04 2020 
समयमै उपचार गरे बहिरोपनमा ६० प्रतिशत कम हुने https://t.co/36fgufV374,Mar 04 2020 
‘हकदाबी नगर्ने सर्तमा बिजुली सुविधा दिन सकिन्छ’ https://t.co/5hZxfjFkus,Mar 04 2020 
रातो मच्छिन्द्रनाथ उपभोक्ता समितिमार्फत पुनर्निर्माण गरिने https://t.co/sGsOxcspVk,Mar 04 2020 
हराउँदै जोगिरा सरर... https://t.co/DZfrbI8oWd,Mar 04 2020 
अमेरिकामा आँधीमा परी ८ जनाको मृत्यु https://t.co/AKcqsk8Axq,Mar 04 2020 
लेखापरीक्षण नगरी गएको महालेखा पुनः खोटाङ आयो https://t.co/eRLndxFlbM,Mar 04 2020 
नेतान्याहुले यसपटक पनि बहुमत ल्याउन नसक्ने मतसर्वेक्षणको अनुमान https://t.co/yZprdRJCgJ,Mar 04 2020 
अनुदान बुझेर पनि बनाएनन् छानो https://t.co/rocMV6gio0,Mar 04 2020 
संस्कार सिकाउने स्कुल https://t.co/JKseuTsNiB,Mar 04 2020 
कोरोना भाइरसबाट मृत्यु हुनेको संख्या तीन हजार एक सय नाघ्यो https://t.co/4UNbi9I0tP,Mar 04 2020 
खुलेन बिरामीको कारण https://t.co/EfU24LD4cU,Mar 04 2020 
‘कोरोना भाइरसको औषधि तयार हुन ६–७ महिना लाग्छ’ https://t.co/WG5qPe0tuP,Mar 04 2020 
आत्म–समर्पणपछि झुम्का कारागारमा सिद्धबाबा https://t.co/pHdmrinf3i,Mar 04 2020 
फलामभित्र राखेर सुन तस्करी https://t.co/lABzc2YOgf,Mar 04 2020 
पश्चिम अफगानिस्तानमा ६ तालिबान लडाकुद्वारा आत्मसमर्पण https://t.co/od1j5Gs814,Mar 04 2020 
मतदाता नामावली सूची अद्यावधिक हुँदै https://t.co/uCzbDvrQAN,Mar 04 2020 
भ्रष्टाचार मुद्दामा पूर्वडिआइजीदेखि खरिदारसम्म https://t.co/4R8OW7SV8n,Mar 04 2020 
सातदोबाटोको रोमाञ्चक जित https://t.co/viwZ06QwOw,Mar 04 2020 
अदालतकाे आदेश अवज्ञामा प्रहरी प्रमुखसहितलाई मुद्दा दर्ता https://t.co/bRaRgxkhL3,Mar 04 2020 
आयोजक सुदूरपश्चिमलाई उपाधि https://t.co/qzSbXcL5wl,Mar 04 2020 
राज्यकोष लुट्ने प्रपञ्च https://t.co/n3UF4rryMk,Mar 04 2020 
सनिलको विजयी सुरुआत https://t.co/ARt7c1dhQs,Mar 04 2020 
सीमा नाकामा उच्च सतर्कता https://t.co/zPPnsGECO1,Mar 04 2020 
वामदेवको राष्ट्रियसभा यात्रा अवरुद्ध https://t.co/ekxK4pSuRm,Mar 04 2020 
