Tweet,Date
अलपत्र टेलिकमको भवन निर्माण सुरु https://t.co/gyxLBqmtkk,Mar 18 2020 
रसुवा भन्सारले फागुनमा २.५ प्रतिशत राजस्व उठायाे https://t.co/MbqfxlVGPW,Mar 18 2020 
महानगर र प्रभु बैंकबीच सम्झौता https://t.co/M7oSWrTPGl,Mar 18 2020 
दादुरा रुबेला खोप अभियान सुरु https://t.co/fNZ2fiT6yQ,Mar 18 2020 
१३ हजार गुनासो सम्बोधन https://t.co/bwhRm0EZfP,Mar 18 2020 
पुनर्निर्माणमा १७ सय लाभग्राही थपिए https://t.co/MoeZGzO2dR,Mar 18 2020 
खरिद ऐन संशोधन गर्दा महासंघको प्रतिनिधित्व माग https://t.co/zDWaQM2tiH,Mar 18 2020 
पशुपतिमा जात्रा हेर्ने निम्ता https://t.co/TM3U2fjL2k,Mar 18 2020 
पुँजीगत खर्च सधैं न्यून https://t.co/jzwsRWCjkp,Mar 18 2020 
तस्करको हातमा चौपाया https://t.co/hCl2WHkkUG,Mar 18 2020 
सुरक्षाको माग गर्दैै पेन डाउन https://t.co/AWE6IGTBjA,Mar 18 2020 
भारतमा थप एकको मृत्यु मर्नेको संख्या तीन पुग्यो https://t.co/GHfLDtud77,Mar 18 2020 
कोरोनासँग जाेगिन पूर्वतयारी https://t.co/N51eu0oupW,Mar 18 2020 
डिक्सन्स कारफोनद्वारा तीन हजार कर्मचारी कटौती https://t.co/RSwxdTCtJY,Mar 18 2020 
स्पेनका राजाद्वारा पिताको सम्पत्ति नलिने घोषणा https://t.co/4Kss94KtaW,Mar 18 2020 
कोभिड–१९ का लागि दुई सय ३५ आइसियू बनाइने https://t.co/auaZMcQoXl,Mar 18 2020 
डारफोरमा सैन्य मिसन अन्त्यको तयारी https://t.co/PZbNIp4VUW,Mar 18 2020 
भरतपुरमा ७२ घण्टाभित्र कोरोना विशेष अस्पताल https://t.co/GCS6HOi5Un,Mar 18 2020 
८० हजार बिरामी निकाे भए https://t.co/LavwfnPzTE,Mar 18 2020 
फोहोर नउठ्दा भैरहवा दुर्गन्धित https://t.co/L7CA25JNfl,Mar 18 2020 
पाकिस्तान सुपर लिग रोकियो https://t.co/mA6qvXu6wa,Mar 18 2020 
चीनको फुटबल टोली स्वदेश फिर्ता https://t.co/GXM9PVkpmf,Mar 18 2020 
अपांगता घटाउन सरकार–गैसस हातेमालो: पाँच वर्षमा दुई अर्ब खर्चिने https://t.co/znR69qwgsr,Mar 18 2020 
सातदोबाटो पहिलो पटक रोकियो https://t.co/YCIk5vFFo0,Mar 18 2020 
कोरोना परीक्षण गर्न साधन अभाव https://t.co/TPZWsWsLAe,Mar 18 2020 
किताब होइन ट्याब बोकेर स्कुल https://t.co/Nk7QqWr3Go,Mar 18 2020 
चारवटै प्रस्ताव सभाबाट अस्वीकृत https://t.co/rFqaXZbtYn,Mar 18 2020 
कोरोना भाइरसले नेपालको अर्थतन्त्रमा कस्तो प्रभाव पार्न सक्छ ? https://t.co/rSdSt7hj3t,Mar 17 2020 
वीरेन्द्रनगरमा खुला नालाले फैलिँदै दुर्गन्ध https://t.co/pTdMj7pjYt,Mar 17 2020 
यात्रुमैत्री चालकलाई प्रहरीको सम्मान https://t.co/rb2y8u61Jy,Mar 17 2020 
सुरक्षाको माग गर्दैै पेन डाउन https://t.co/AnkBU3IdYg,Mar 17 2020 
भोजपुरमा पर्यटन अफिसलाई क्वारेन्टाईन बनाइने https://t.co/GQtGUlIsPb,Mar 17 2020 
सरकारले हाम्राे माग नसुने उद्योग बन्द गर्नुको बिकल्प छैन : उद्योगी https://t.co/iO5xYVXpOy,Mar 17 2020 
जुम्लामा एसइईमा कडाई : परिक्षा हलमा मोबाइल निषेध https://t.co/hiH11MCc7Q,Mar 17 2020 
कोरोना त्रास : सावधानी नै बचावट https://t.co/fa9Az3miMF,Mar 17 2020 
एसईई परीक्षा स्थगित हुँदैन : मन्त्री खतिवडा https://t.co/MgV363sihO,Mar 17 2020 
इलाममा आइसोलेसन तयार गरिँदै https://t.co/bokWbpowYQ,Mar 17 2020 
प्रदेश दुईको नाम मध्यमधेस पनि अस्वीकृत https://t.co/aypuL5q4IZ,Mar 17 2020 
प्रदेश नम्बर २ को राजधानी र नामाकरण गर्न मतदान नेकपा र कांग्रेसले गरेको प्रस्ताव अस्वीकृत https://t.co/kTFHp33pLb,Mar 17 2020 
भाउजु हत्या गर्ने देवरहरु प्रहरीद्वारा सार्वजनिक https://t.co/0wLiZvKI4X,Mar 17 2020 
कोरोनाको सन्त्रासले घर फर्किदै नेपाली https://t.co/MSsdl7X0ha,Mar 17 2020 
बसपार्कमा हेल्थ डेक्स अस्पतालमा हात धोएर मात्रै प्रवेश https://t.co/3xCxTDSKxK,Mar 17 2020 
जानकी प्रदेशमा ३७ मत खस्यो https://t.co/Ln049CL3CX,Mar 17 2020 
संसद रोक्न संसदको माग https://t.co/U1KnGGgB3X,Mar 17 2020 
लडेको चोटले बालकको नाजुक अवस्था https://t.co/IrSBv6sTlv,Mar 17 2020 
विद्यालय तहमा प्रवेश परीक्षाको औचित्य https://t.co/1oYe8r9SyO,Mar 17 2020 
प्रदेश २ को नाम र राजधानी टुंग्याउन मतदान https://t.co/dGRaXscriw,Mar 17 2020 
बुबाले मैदान छाडे पनि मैदान नछाडेकी पुष्पा https://t.co/q44m3eG6bO,Mar 17 2020 
कर्मचारीले गर्ने सबै कसुरमा एउटै सजाय हुन नहुनेमा सांसदहरुको जोड https://t.co/N5Fkff7scT,Mar 17 2020 
ठेकेदारले कालोपत्रे नगरेपछि स्थानीयद्वारा बारपाक सडक अवरुद्ध https://t.co/e9xMBFjPHB,Mar 17 2020 
'चोर पक्राउ गर्न’ भारतीय प्रहरी दैलेखमा https://t.co/yRBVM5so2X,Mar 17 2020 
‘अमेरिकन आइडल’ मा चर्चा बटुल्दै नेपाली मूलका दिवेश https://t.co/jkOJGTuDZf,Mar 17 2020 
आमाछोरीको मृत्युपछि पनौतीबजार क्षेत्रमा अनिश्चितकालीन कर्फ्यू https://t.co/zNQSS2ZfN1,Mar 17 2020 
कांग्रेसका ३५ जिल्लामा सभापति उठ्न महाधिवेशन प्रतिनिधि जित्नु नपर्ने https://t.co/QCYRub9mbc,Mar 17 2020 
कोरोना त्रास : सुनसान हुन थाले जमघटस्थल https://t.co/JlXcLDiTCN,Mar 17 2020 
काठसहित तीन पक्राउ https://t.co/QyM0SUn5P1,Mar 17 2020 
प्रदेश २ मा नाम र राजधानीबारे मतदान हुँदै https://t.co/soZvFadAX4,Mar 17 2020 
प्राधिकरणले अधिग्रहण गरेको सरकारी जग्गा ‘किनबेच’ https://t.co/PVdaU9nzsT,Mar 17 2020 
भत्किएको ३ वर्षमा पनि मर्मत भएन सडक https://t.co/46AjvrRfxv,Mar 17 2020 
मनोरञ्जन गतिविधि प्रभावित https://t.co/cXKDkgajgx,Mar 17 2020 
कलामार्फत सांस्कृतिक धरोहरको संरक्षण https://t.co/CeAyNDjjhM,Mar 17 2020 
न्युयोर्क र लस एन्जल्सका हल बन्द गर्न आदेश https://t.co/scqwakNrk6,Mar 17 2020 
जेम्स बोन्ड अभिनेत्रीलाई कोरोना संक्रमण https://t.co/wZb8acYw1m,Mar 17 2020 
संक्रमणकालीन न्यायको यथार्थता https://t.co/CqD0LEB6yt,Mar 17 2020 
वातावरणमैत्री बनाऊ इँटा उद्योग https://t.co/C146rrp0IR,Mar 17 2020 
कोभिड–१९ को असर https://t.co/yz3gSAPB6r,Mar 17 2020 
कोरोनाको राक्षसीकरण https://t.co/sjZ2Y26oFj,Mar 17 2020 
विषाणुविरुद्ध विजय https://t.co/Z4WvevmHnK,Mar 17 2020 
विद्यालय भवन निर्माणमा भारतको सहयोग https://t.co/pZnE3bvzi0,Mar 17 2020 
निर्णय पुनर्विचार गर्न यातायात व्यसायीको आग्रह https://t.co/NTPS8JkDcH,Mar 17 2020 
समस्यामा सहयोग गर्ने सरकारकाे नीति https://t.co/lmZtOUwdmi,Mar 17 2020 
२७ वर्षअघिको कानुनबाट काम चलाउँदै https://t.co/B7Ud0m8vOh,Mar 17 2020 
पौडेललाई अदालतले थुनामा पठायो https://t.co/qOolkonsGh,Mar 17 2020 
रेबिजका कारण बालकको मृत्यु https://t.co/cpZPcoknRF,Mar 17 2020 
डाक्टरमाथि हातपात सेवा ठप्प https://t.co/1gBrY8gtjl,Mar 17 2020 
प्रदेश राजधानी हेटाैंडा पुग्ने छोटो बाटो खोजिँदै https://t.co/9Ot0DcAO0f,Mar 17 2020 
‘कोरोनाविरुद्धको गम्भीर हुन आग्रह' https://t.co/UTiITSP70j,Mar 17 2020 
चितवनमा नुन अभाव नहुने https://t.co/v3hpvcja2s,Mar 17 2020 
काभ्रेमा रासायनिक विषादीको खपत घट्यो https://t.co/3OmKzCxgnl,Mar 17 2020 
नेपालमा रेल सवा दुई सय कर्मचारी भर्ना तयारी https://t.co/7rCBchnjuh,Mar 17 2020 
‘मेलम्चीको पानी असारमा सुन्दरीजल असोजमा घर–घरमा’ https://t.co/QN9Fzol8ct,Mar 17 2020 
एक रहेको सन्देश दिँदै कांग्रेसको तेस्रो धार https://t.co/tAzB28lXJJ,Mar 17 2020 
आधा अर्ब नाफा राखेर इन्धनको मूल्य समायोजन https://t.co/Xg5Si1aIiq,Mar 17 2020 
सफल होला अफगान शान्ति वार्ता ? https://t.co/xjXS6Vc2ng,Mar 17 2020 
इटालीमा एकै दिनमा ३६८ जनाको मृत्यु https://t.co/oeWgDAWBa7,Mar 17 2020 
इजरायलमा नेतन्याहु युगको अन्त्य https://t.co/w9WZC2qGwt,Mar 17 2020 
कोरोनाविरुद्ध युद्धस्तरमा कार्य गरौं: देउवा https://t.co/irX2VdNa5d,Mar 17 2020 
राजधानी र नामकरण टुंग्याउन आज मतदान https://t.co/8rJtL0zM46,Mar 17 2020 
स्वास्थ्कर्मीलाई नै छैन भाइरसप्रतिरोधी मास्क https://t.co/ynnzuZkFjJ,Mar 17 2020 
सविनको ह्याट्रिकमा खुमलटारलाई सफलता https://t.co/DU1WOe0cMQ,Mar 17 2020 
कोरोना त्रास घटे आइपिएल छोट्याएर खेलाइने https://t.co/xAVPRZAeKR,Mar 17 2020 
कोरोनालाई सामान्य नलिन चेतावनी https://t.co/2H5R3qDbat,Mar 17 2020 
आमालाई खोजिरहेछन् अबोध आँखा https://t.co/e2rrWcahno,Mar 17 2020 
प्रदेश २ लाई ‘विशेष प्रदेश’ किन चाहियो https://t.co/hMdvdLardT,Mar 17 2020 
परीक्षा केन्द्रमा परीक्षार्थीलाई नछुन निर्देशन https://t.co/MbYfYqqFzf,Mar 17 2020 
'कोरोना प्रभावितलाई सरकारले संरक्षण गर्छ' https://t.co/pzbaLSUjVU,Mar 17 2020 
मास्कमा कालोबजारी: १० लाख ८ हजार मास्कसहित पाँच पक्राउ https://t.co/zDiebJLEPI,Mar 17 2020 
अस्पतालमा मौसमी फ्लुका बिरामी बढे https://t.co/3NwMvA8ai1,Mar 17 2020 
३५ विदेशी नागरिक विमानस्थलबाटै फिर्ता https://t.co/M0xaDpkFJw,Mar 17 2020 
एमसिसीबारे नेकपाको निर्णय पर्खँदै सभामुख https://t.co/dtlZp0R2RQ,Mar 16 2020 
एमसिसीबारे नेकपाको निर्णय पर्खँदै सभामुख https://t.co/ei4lnkkrh4,Mar 16 2020 
तनहुँमा १२ शैय्याको ‘आइसोलेसन’ https://t.co/rLh1Eybjlb,Mar 16 2020 
बजारमा अभाव नरहेको ग्यास उद्योग संघकाे दाबी https://t.co/MMl9qIc1ts,Mar 16 2020 
अस्पतालको क्षमता मुल्याङ्कन गर्न कृतिम दुर्घटना अभ्यास https://t.co/2mal0QLWbk,Mar 16 2020 
कोरोनाको सामना गर्न सहयोग गर्न तयार रहेको चिकित्सक संघको भनाइ https://t.co/oxRtqvuESM,Mar 16 2020 
रौतहटमा अवैध हतियारको कारोबार बढ्दो https://t.co/3tEgKDwbao,Mar 16 2020 
नागरिक राउन्ड टेवल नेपाली अर्थतन्त्रमा कोरोना प्रभाव : जोखिमको व्याख्या बढी पनि नगरौं कम पनि नगरौं https://t.co/sfcksqRxyv,Mar 16 2020 
विषाक्त मदिरा कहरः मृतकको संख्या २१ पुग्यो त्रासमा गाउँले https://t.co/8zVHSc9myh,Mar 16 2020 
रेडक्रसमा भएको भ्रष्टाचारका विषयमा छानबिन सुरु स्पष्ट कानूनी व्यवस्था नहुँदा समस्या https://t.co/iOwEuFdSIE,Mar 16 2020 
सांसदको चिन्ता : कोरोनाबारे तयारी कम भयो https://t.co/EcKhQc4C8n,Mar 16 2020 
साढे ८ लाख थान मास्कसहित दुई व्यापारी पक्राउ https://t.co/wjFQJrPs5H,Mar 16 2020 
खानेपानीमन्त्री मगर मेलम्ची आयोजना अनुगमनमा https://t.co/xtViZQpLNo,Mar 16 2020 
नेपाली भू–भागमा गाडिएका सीमा पिलर खारेजीको माग https://t.co/k9R9r74xjj,Mar 16 2020 
६ लेन सडक किनारमै 'स्मार्ट शौचालय' https://t.co/O9jZmYDBAC,Mar 16 2020 
अहिले नाफा खाएर व्यापार गर्ने समय होइन। यो संकटमा हामी सरकारसँगै छौं भनेर सरकारले भनेको छ। यो सकारात्मक छ। सरकार तपाईहरुसँगै छ। - युवराज खतिवडा अर्थमन्त्री,Mar 16 2020 
असर परिसकेको क्षेत्रको मूल्याङकन गरेर सरकारले सहयोग गर्छ। - युवराज खतिवडा अर्थमन्त्री,Mar 16 2020 
स्वास्थ्य क्षेत्रमा काम गर्नेहरुको सुरक्षाको लागि सरकारले तयारी गरिरहेको छ। - युवराज खतिवडा अर्थमन्त्री,Mar 16 2020 
सहुलियत पसल सञ्चालन गर्ने विषयमा सरकारले सोचिरहेको छ। - युवराज खतिवडा अर्थमन्त्री,Mar 16 2020 
बजारमा अभाव हुन दिँदैनौ । - युवराज खतिवडा अर्थमन्त्री,Mar 16 2020 
व्यवसायलाई जोगाउने गरी व्याजदरमा काम हुँदैछ। त्यसमा राष्ट्र बै‌कले तयारी गरिरहेको छ। - युवराज खतिवडा अर्थमन्त्री,Mar 16 2020 
जुन व्यवसायमा असर गरेको छ त्यहाँ करमा हेर्ने र अनुदान दिनुपर्ने हो भने त्यो पनि हेर्न सक्नेगरी जानुपर्छ। - युवराज खतिवडा अर्थमन्त्री,Mar 16 2020 
संकटलाई कसैले पैसाकमाउने अवसरको रुपमा लिनुहुँदैन। - शेखर गोल्छा,Mar 16 2020 
सामानको अभाव हुन नदिन G to G पहल गर्नुपर्छ। - रामेश्वर खनाल https://t.co/vPSLNXk2AY,Mar 16 2020 
लोन रिसेड्युलिङ गर्न चाहन्छ भने त्यसमा राष्ट्र बै‌कले सहयोग गर्नुपर्छ। - शेखर गोल्छा,Mar 16 2020 
कोरोनाबारे जनचेतना फैलाउन सबैले पहल गर्नुपर्छ। विरामी भए कहाँ जाने ? भन्ने जानकारी दिनुपर्छ। - विमला पौड्याल राई,Mar 16 2020 
सार्क मुलुकहरुले कोरोनाविरुद्ध सामूहिकरुपमा जान पहल गर्नु सकारात्मक छ। - विमला पौड्याल राई,Mar 16 2020 
कोरोनाको शंका लागेमा कहाँ जाने भनेर आम नागरिकले थाहा पाउने र त्यहाँ जान सक्नेगरी सरकारले व्यवस्था मिलाउनु पर्छ। - विमला पौड्याल राई https://t.co/Ravah2ohpy,Mar 16 2020 
सरकारले विभिन्न स्थानमा सुपथ मूल्य पसलहरु खोल्नुपर्छ। - विमला पौड्याल राई,Mar 16 2020 
व्याजदरमा सरकारले सोच्नुपर्छ। -विश्व पौडेल https://t.co/9OFn6bcYAI,Mar 16 2020 
मूल्य नियन्त्रणमा सरकारले ध्यान दिनुपर्छ। यसले सिधा सर्वसाधारणलाई प्रभाव पार्छ। -विश्व पौडेल,Mar 16 2020 
करमा धेरै जोड दिनु हुँदैन। अप्ठ्यारो परेका क्षेत्र पहिल्याएर सरकारले काम गर्नुपर्छ। -विश्व पौडेल,Mar 16 2020 
झापाका बिरामीमा भेटिएन कोभिड–१९ सङ्क्रमण https://t.co/GMiQBKQtaG,Mar 16 2020 
शेखर गोल्छा https://t.co/em6uo9tXBz,Mar 16 2020 
भारतमा कोरोना देखिइसकेको छ। त्यहाँ लक्ड डाउन भयो भने हामीलाई असर गर्छ। -शेखर गोल्छा,Mar 16 2020 
भिजिट नेपाल २०२० लाई हेरेर व्यवसायीहरुले लगानी बढाएका थिए अहिले त्यो लगानी जोखिममा छ । -शेखर गोल्छा,Mar 16 2020 
पूर्वअर्थ सचिव रामेश्वर खनालले राउन्ड टेवलमा सहजिकरण गरिरहेका छन् ।,Mar 16 2020 
व्याज भनेको कमाइ भएको अवस्थामा मात्र तिर्न सकिन्छ। यो अवस्थामा केही सोच्नु पर्छ। - उमेशलाल श्रेष्ठ,Mar 16 2020 
आवस्यक सामानमात्र खरिद गरौं । स्टोरेज नगरौं । - उमेशलाल श्रेष्ठ,Mar 16 2020 
सरकारले औषधी खाद्यन्न लगायत दैनिक उपभोग्य बस्तुबारे सोच्नुपर्छ। - उमेशलाल श्रेष्ठ,Mar 16 2020 
त्रासका कारण स्टोर गर्ने कारणले समस्या देखिएको छ । - उमेशलाल श्रेष्ठ,Mar 16 2020 
सरकारले कोरोना भाइरसको विषयमा पूर्णरुपमा तयारी गर्न सकेन । - उमेशलाल श्रेष्ठ,Mar 16 2020 
कोरोनाका कारण अहिलेको सिजनमा पर्यटनमा असर गर्यो। अर अर्को सिजनमा हामीले रिभाइभ गर्न सक्छौै । - युवराज खतिवडा,Mar 16 2020 
व्यापार श्रम लगानी र पूँजीबजारमा कोरोनाले असर गर्यो। - युवराज खतिवडा,Mar 16 2020 
अर्थमन्त्री युवराज खतिवडा सांसद विमला पौड्याल राईअर्थ मन्त्रालयका सहसचिव रामप्रसाद घिमिरे उद्योग बाणिज्य महासंघका बरिष्ठ उपाध्यक्ष शेखर गोल्छा उपाध्यक्ष उमेशलाल श्रेष्ठ पूर्व अर्थसचिव रामेश्वर खनाल र अर्थशास्त्री विश्व पौडेल राउन्ड टेवलमा । https://t.co/DyJJlTbl8f,Mar 16 2020 
नेपाली अर्थतन्त्रमा कोरोना भाइरसको प्रभावबारे नेपाल रिपप्लिक मिडियाले आयोजना गरेको राउन्ड टेवल। https://t.co/TcWQ74t5Ee,Mar 16 2020 
खीर व्यापारबाट लाखौँ आम्दानी https://t.co/5s9FWyFFX6,Mar 16 2020 
सीपले आत्मनिर्भरतर्फ https://t.co/bBbb8UXkAb,Mar 16 2020 
महालक्ष्मी बैंकको सहयोग https://t.co/csywYg0d2x,Mar 16 2020 
ज्ञवाली सरका अर्धसत्य https://t.co/L3EDxBJQEL,Mar 16 2020 
मिडिया साक्षरता https://t.co/7zVndWQtCE,Mar 16 2020 
समानताका लागि भूमि अधिकार https://t.co/DxWK0AY5Cm,Mar 16 2020 
ग्यास आयात बढ्यो https://t.co/MMdgNYMJDQ,Mar 16 2020 
नेपालमा कोरोना फैलिँदैन ! https://t.co/scSbuzuxyq,Mar 16 2020 
‘जिरो प्रोजेक्ट अवार्ड’ सम नेपाललाई https://t.co/il53tKQyzk,Mar 16 2020 
अन्तर्राष्ट्रिय उडान ३५ प्रतिशत घट्यो https://t.co/E5rcErgWLO,Mar 16 2020 
ख्वप अस्पताल सञ्चालनमा ल्याउने https://t.co/bhR7D1C6Y7,Mar 16 2020 
प्रहरी र अस्पतालको सचेतनामूलक कार्यक्रम https://t.co/JfOTOVI8Ya,Mar 16 2020 
